--
-- REFRESH MATERIALIZED VIEW ... WHERE ...: the contract
--
-- What the feature promises, with no reference to how it is implemented.  The
-- other files in this suite are organised by defect and answer "is this bug
-- still fixed".  This one answers "does the feature still do what it promises".
--
-- Two promises need more than one session and live as isolation specs.  They
-- are listed here so the contract reads in one place:
--
--   readers never block                matview-where-serialize
--   overlapping refreshes serialize,   matview-where-serialize
--     disjoint ones do not
--   deterministic lock order,          matview-where-lockorder     (existing rows)
--     so overlapping refreshes         matview-where-insertorder   (inserted rows)
--     cannot deadlock
--
CREATE TABLE ct_base (id int PRIMARY KEY, grp int, val int);
INSERT INTO ct_base SELECT g, g % 4, g * 10 FROM generate_series(1, 12) g;
CREATE MATERIALIZED VIEW ct_mv AS SELECT id, grp, val FROM ct_base;
CREATE UNIQUE INDEX ON ct_mv(id);
--
-- Promise 1: a refresh makes its scope match what a full refresh would make it.
--
-- Compared against the view query itself, so it holds for any implementation
-- that produces the right rows.
--
UPDATE ct_base SET val = val + 1 WHERE id <= 6;
REFRESH MATERIALIZED VIEW CONCURRENTLY ct_mv WHERE id <= 6;
SELECT count(*) AS p1_bare_in_scope_differs_from_view
  FROM ((SELECT id, grp, val FROM ct_mv WHERE id <= 6)
        EXCEPT ALL
        (SELECT id, grp, val FROM ct_base WHERE id <= 6)) d;
 p1_bare_in_scope_differs_from_view 
------------------------------------
                                  0
(1 row)

UPDATE ct_base SET val = val + 1 WHERE id <= 6;
REFRESH MATERIALIZED VIEW CONCURRENTLY ct_mv WHERE id <= 6;
SELECT count(*) AS p1_conc_in_scope_differs_from_view
  FROM ((SELECT id, grp, val FROM ct_mv WHERE id <= 6)
        EXCEPT ALL
        (SELECT id, grp, val FROM ct_base WHERE id <= 6)) d;
 p1_conc_in_scope_differs_from_view 
------------------------------------
                                  0
(1 row)

--
-- Promise 2: rows outside the scope are untouched.
--
-- Checking that the matview still holds what it held would pass even if the
-- refresh had rewritten those rows identically.  So change the base outside the
-- scope, refresh inside it, and require the matview to still show the old
-- values.  That fails if the refresh touched anything it should not have.
--
UPDATE ct_base SET val = 999 WHERE id > 6;
REFRESH MATERIALIZED VIEW CONCURRENTLY ct_mv WHERE id <= 6;
SELECT count(*) AS p2_out_of_scope_rows_changed
  FROM ct_mv WHERE id > 6 AND val = 999;
 p2_out_of_scope_rows_changed 
------------------------------
                            0
(1 row)

-- and the in-scope half is still correct after that refresh
SELECT count(*) AS p2_in_scope_wrong
  FROM ((SELECT id, grp, val FROM ct_mv WHERE id <= 6)
        EXCEPT ALL
        (SELECT id, grp, val FROM ct_base WHERE id <= 6)) d;
 p2_in_scope_wrong 
-------------------
                 0
(1 row)

--
-- Promise 3: a row that leaves the scope is deleted.
--
-- This is deliberate and it is documented.  The predicate names a region of
-- the matview and a refresh makes that region match the view, so a row that no
-- longer satisfies the view definition is removed rather than left behind.
--
CREATE TABLE ct_act (id int PRIMARY KEY, state text, val int);
INSERT INTO ct_act VALUES (1, 'on', 10), (2, 'on', 20), (3, 'off', 30);
CREATE MATERIALIZED VIEW ct_act_mv AS
  SELECT id, state, val FROM ct_act WHERE state = 'on';
CREATE UNIQUE INDEX ON ct_act_mv(id);
SELECT count(*) AS p3_initial FROM ct_act_mv;
 p3_initial 
------------
          2
(1 row)

UPDATE ct_act SET state = 'off' WHERE id = 1;
REFRESH MATERIALIZED VIEW CONCURRENTLY ct_act_mv WHERE id = 1;
-- id 1 has left the view's scope, so it must be gone; id 2 must remain.
SELECT id FROM ct_act_mv ORDER BY id;
 id 
----
  2
(1 row)

--
-- Promise 4: a row that enters the scope is added.
--
UPDATE ct_act SET state = 'on' WHERE id = 3;
REFRESH MATERIALIZED VIEW CONCURRENTLY ct_act_mv WHERE id = 3;
SELECT id FROM ct_act_mv ORDER BY id;
 id 
----
  2
  3
(2 rows)

--
-- Promise 5, that the command reports the number of rows it changed, is not
-- here.  pg_regress does not echo command tags, so the rowcount never reaches
-- the output and a check placed here would pass whatever the answer was.  It
-- is covered in contrib/pg_stat_statements/sql/utility.sql instead, where the
-- count is visible.
--
--
-- Promise 6: a refresh that changes nothing changes nothing.
--
-- Repeating a no-op refresh is a cheap way to catch the upsert and the
-- anti-join disagreeing about which rows the view produces.  It is what caught
-- a NULLable unique key duplicating the NULL-keyed rows on every refresh.
--
CREATE TABLE ct_null (id int, val text);
INSERT INTO ct_null VALUES (NULL, 'x'), (1, 'a'), (NULL, 'y');
CREATE MATERIALIZED VIEW ct_null_mv AS SELECT id, val FROM ct_null;
CREATE UNIQUE INDEX ON ct_null_mv(id);
-- Count after each refresh rather than once at the end.  A count taken only at
-- the end can be measuring a later refresh repairing what an earlier one broke.
SELECT count(*) AS p6_before FROM ct_null_mv;
 p6_before 
-----------
         3
(1 row)

REFRESH MATERIALIZED VIEW CONCURRENTLY ct_null_mv WHERE id IS NULL;
REFRESH MATERIALIZED VIEW CONCURRENTLY ct_null_mv WHERE id IS NULL;
SELECT count(*) AS p6_after_two_concurrent_noops FROM ct_null_mv;
 p6_after_two_concurrent_noops 
-------------------------------
                             3
(1 row)

REFRESH MATERIALIZED VIEW CONCURRENTLY ct_null_mv WHERE id IS NULL;
SELECT count(*) AS p6_after_bare_noop FROM ct_null_mv;
 p6_after_bare_noop 
--------------------
                  3
(1 row)

--
-- Promise 7: a partial refresh converges with a full one.
--
-- This is the promise the feature rests on.  Whatever a partial refresh does
-- to the rows its predicate names, the result has to be what a full refresh
-- would have produced.  Two identical matviews, one refreshed each way.
--
CREATE TABLE ct_agree (id int PRIMARY KEY, grp int, val int);
INSERT INTO ct_agree SELECT g, g % 3, g FROM generate_series(1, 9) g;
CREATE MATERIALIZED VIEW ct_agree_a AS
  SELECT grp, sum(val) AS total FROM ct_agree GROUP BY grp;
CREATE UNIQUE INDEX ON ct_agree_a(grp);
CREATE MATERIALIZED VIEW ct_agree_b AS
  SELECT grp, sum(val) AS total FROM ct_agree GROUP BY grp;
CREATE UNIQUE INDEX ON ct_agree_b(grp);
UPDATE ct_agree SET val = val * 2 WHERE grp = 1;
REFRESH MATERIALIZED VIEW ct_agree_a;
REFRESH MATERIALIZED VIEW CONCURRENTLY ct_agree_b WHERE grp = 1;
-- Both directions, because EXCEPT ALL is not symmetric.  One way finds rows
-- the partial refresh failed to produce, the other finds rows it produced and
-- should not have.
SELECT count(*) AS p7_full_has_rows_partial_does_not
  FROM ((SELECT grp, total FROM ct_agree_a)
        EXCEPT ALL
        (SELECT grp, total FROM ct_agree_b)) d;
 p7_full_has_rows_partial_does_not 
-----------------------------------
                                 0
(1 row)

SELECT count(*) AS p7_partial_has_rows_full_does_not
  FROM ((SELECT grp, total FROM ct_agree_b)
        EXCEPT ALL
        (SELECT grp, total FROM ct_agree_a)) d;
 p7_partial_has_rows_full_does_not 
-----------------------------------
                                 0
(1 row)

--
-- Cleanup
--
DROP MATERIALIZED VIEW ct_agree_a, ct_agree_b;
DROP TABLE ct_agree;
DROP MATERIALIZED VIEW ct_null_mv;
DROP TABLE ct_null;
DROP MATERIALIZED VIEW ct_act_mv;
DROP TABLE ct_act;
DROP MATERIALIZED VIEW ct_mv;
DROP TABLE ct_base;
