--
-- REFRESH MATERIALIZED VIEW ... WHERE ... : privileges and session state
--
-- These tests exercise the security boundary of the WHERE clause and the
-- session-level matview maintenance flag.  Each one says whether it came from
-- the -hackers thread "[Patch] Add WHERE clause support to REFRESH MATERIALIZED
-- VIEW" or was found separately, so that review items can be checked off
-- against it.
--
-- Every case covers a live defect.  The expected output describes what the
-- command should do, so they fail until the defect is fixed, and an XXX comment
-- names the behaviour seen today.
--
-- Where the correct outcome is "the statement is rejected", the statement is
-- wrapped in a block that reports the SQLSTATE instead of letting the message
-- text through.  The fix that produces the rejection has not been written yet,
-- so its wording is not knowable here; the SQLSTATE that a correct rejection
-- must carry is.
--
-- Disposition: keep, all three.  These are security regressions, and the
-- classes they cover -- a caller reaching objects through a predicate it could
-- not reach directly, a predicate modifying a matview, and an error leaving the
-- maintenance flag raised -- are all easy to reintroduce.  They should stay in
-- the tree after the fixes land.
--
-- One qualification, for Test 1 specifically.  It asserts the RULE -- a
-- non-leakproof predicate requires ownership -- rather than the property the
-- rule exists to deliver, which is that a predicate cannot read across a
-- privilege boundary.  The rule is needed because SPI runs the whole statement
-- under one userid, so the predicate necessarily runs as the owner.
--
-- If the Query-tree work lets the predicate be evaluated as the invoker, the
-- leak stops being possible instead of being forbidden, and the right expected
-- output for this test becomes "succeeds".  At that point the test does not
-- merely stop applying, it INVERTS: it would report a strictly better
-- implementation as a security regression.  Rewrite it then to assert that the
-- leak cannot happen rather than that the rejection does -- do not simply
-- regenerate the expected output, which would silently retire the check.
-- See src/test/matview_where_stress/PLAN.md 1.4.
--
-- The last test deliberately leaves the session unable to protect any matview
-- from direct DML, so nothing may be added after it.
--
--
-- Test 1: The predicate must not run with the matview owner's privileges
--
-- Reported on -hackers by Zsolt Parragi: "The patch in its current form has a
-- security escalation bug, WHERE functions are executed with the privileges of
-- the owner, not the maintainer."  Acknowledged by Adam Brusselback, who
-- proposed allowing MAINTAIN callers only when every function in the predicate
-- is leakproof and requiring ownership otherwise.  This is Zsolt's repro.
--
-- RefreshMatViewByOid() switches to the owner before analyzing or executing
-- anything, so functions named in a caller-supplied predicate run as the
-- owner.  A caller holding only MAINTAIN must not be able to reach objects it
-- has no privileges on.
--
CREATE ROLE regress_matview_owner;
CREATE ROLE regress_matview_maint;
CREATE TABLE matview_priv_target (note text);
CREATE MATERIALIZED VIEW matview_priv_mv AS SELECT 1 AS id;
CREATE UNIQUE INDEX ON matview_priv_mv (id);
ALTER TABLE matview_priv_target OWNER TO regress_matview_owner;
ALTER MATERIALIZED VIEW matview_priv_mv OWNER TO regress_matview_owner;
CREATE SCHEMA matview_priv_atk AUTHORIZATION regress_matview_maint;
GRANT MAINTAIN ON matview_priv_mv TO regress_matview_maint;
SET ROLE regress_matview_maint;
GRANT USAGE ON SCHEMA matview_priv_atk TO regress_matview_owner;
-- The write is done by a volatile function, wrapped in a stable one so that
-- the volatility check in transformRefreshWhereClause() does not reject it.
CREATE FUNCTION matview_priv_atk.do_write() RETURNS void
  LANGUAGE plpgsql VOLATILE AS $$
BEGIN
  INSERT INTO public.matview_priv_target
    VALUES ('written as ' || pg_catalog.current_user());
END $$;
CREATE FUNCTION matview_priv_atk.pred(int) RETURNS boolean
  LANGUAGE plpgsql STABLE AS $$
BEGIN
  PERFORM matview_priv_atk.do_write();
  RETURN true;
END $$;
-- The caller cannot write to the table directly.
INSERT INTO public.matview_priv_target VALUES ('direct write');
ERROR:  permission denied for table matview_priv_target
-- A predicate naming a function the caller could not usefully run itself must
-- be refused.  42501 is insufficient_privilege.
-- XXX currently allowed.
DO $$
BEGIN
  EXECUTE 'REFRESH MATERIALIZED VIEW matview_priv_mv'
          ' WHERE matview_priv_atk.pred(id)';
  RAISE NOTICE 'refresh was allowed';
EXCEPTION WHEN others THEN
  RAISE NOTICE 'refresh was rejected, SQLSTATE %', SQLSTATE;
END $$;
NOTICE:  refresh was rejected, SQLSTATE 42501
RESET ROLE;
-- Must be empty.
-- XXX currently holds one row per predicate evaluation: the refresh evaluates
-- the predicate three times, once for the row-locking SELECT, once for the
-- new_data CTE and once for the anti-join DELETE.
SELECT note, count(*) AS predicate_evaluations
  FROM matview_priv_target GROUP BY note;
 note | predicate_evaluations 
------+-----------------------
(0 rows)

DROP FUNCTION matview_priv_atk.pred(int);
DROP FUNCTION matview_priv_atk.do_write();
DROP SCHEMA matview_priv_atk;
DROP MATERIALIZED VIEW matview_priv_mv;
DROP TABLE matview_priv_target;
DROP ROLE regress_matview_maint;
DROP ROLE regress_matview_owner;
--
-- Test 2: The predicate must not run inside the matview maintenance window
--
-- Not reported on -hackers.  Related to Zsolt Parragi's escalation report
-- above, but distinct from it and not covered by the leakproof gating proposed
-- in reply: the predicate runs not only as the owner but with matview write
-- protection switched off, which is exposure the full and concurrent refresh
-- paths do not have, since the statements they run inside that window contain
-- no user-supplied expressions.
--
-- OpenMatViewIncrementalMaintenance() is called before the SPI statements that
-- evaluate the predicate, so a predicate function is exempt from the "cannot
-- change materialized view" check -- and that exemption is global, not scoped
-- to the matview being refreshed.
--
-- Everything here is owned by the role running the test, so that no ACL
-- failure can mask the behaviour under test.
--
CREATE TABLE matview_mw_base (id int primary key, v text);
INSERT INTO matview_mw_base VALUES (1, 'a');
CREATE MATERIALIZED VIEW matview_mw_driver AS SELECT id, v FROM matview_mw_base;
CREATE UNIQUE INDEX ON matview_mw_driver (id);
CREATE TABLE matview_mw_vbase (id int primary key, v text);
INSERT INTO matview_mw_vbase VALUES (1, 'a'), (2, 'b');
CREATE MATERIALIZED VIEW matview_mw_victim AS SELECT id, v FROM matview_mw_vbase;
CREATE UNIQUE INDEX ON matview_mw_victim (id);
CREATE FUNCTION matview_mw_write() RETURNS void
  LANGUAGE plpgsql VOLATILE AS $$
BEGIN
  DELETE FROM public.matview_mw_victim;
  INSERT INTO public.matview_mw_victim VALUES (99, 'injected');
END $$;
CREATE FUNCTION matview_mw_pred(int) RETURNS boolean
  LANGUAGE plpgsql STABLE AS $$
BEGIN
  PERFORM public.matview_mw_write();
  RETURN true;
END $$;
-- Called outside a refresh, the write is correctly refused.
SELECT public.matview_mw_write();
ERROR:  cannot change materialized view "matview_mw_victim"
CONTEXT:  SQL statement "DELETE FROM public.matview_mw_victim"
PL/pgSQL function matview_mw_write() line 3 at SQL statement
SELECT count(*) AS victim_rows_before FROM matview_mw_victim;
 victim_rows_before 
--------------------
                  2
(1 row)

-- Reached through a predicate, the same write must still be refused.  42809 is
-- wrong_object_type, which is what "cannot change materialized view" carries.
-- XXX currently allowed.
DO $$
BEGIN
  EXECUTE 'REFRESH MATERIALIZED VIEW matview_mw_driver'
          ' WHERE public.matview_mw_pred(id)';
  RAISE NOTICE 'refresh was allowed';
EXCEPTION WHEN others THEN
  RAISE NOTICE 'refresh was rejected, SQLSTATE %', SQLSTATE;
END $$;
NOTICE:  refresh was rejected, SQLSTATE 42809
-- Must be the two original rows.
-- XXX currently replaced by the row the predicate inserted.
SELECT * FROM matview_mw_victim ORDER BY id;
 id | v 
----+---
  1 | a
  2 | b
(2 rows)

DROP FUNCTION matview_mw_pred(int);
DROP FUNCTION matview_mw_write();
DROP MATERIALIZED VIEW matview_mw_victim;
DROP TABLE matview_mw_vbase;
DROP MATERIALIZED VIEW matview_mw_driver;
DROP TABLE matview_mw_base;
--
-- Test 3: matview_maintenance_depth must not leak when a refresh fails
--
-- Reported on -hackers by Zsolt Parragi: "There's also another issue where an
-- error during refresh removes the modification restrictions."  Diagnosed by
-- Adam Brusselback as "a missing PG_TRY around the
-- OpenMatViewIncrementalMaintenance()/Close pair in the direct-modification
-- path (the match/merge site already handles it)", with "Will fix".  This is
-- Zsolt's repro, extended to show that the exemption is not scoped to the
-- matview being refreshed.
--
-- refresh_by_direct_modification() has no PG_TRY between
-- OpenMatViewIncrementalMaintenance() and its matching Close (compare the
-- match/merge call site, which does).  An error in between skips the Close and
-- leaves the counter above zero, disabling the "cannot change materialized
-- view" check for the remainder of the session.
--
-- NB: while this leak still exists, nothing may be added after this test.
--
CREATE TABLE mv_leak_base (id int, code int, v text);
INSERT INTO mv_leak_base VALUES (1, 100, 'a'), (2, 200, 'b'), (3, 300, 'c');
CREATE MATERIALIZED VIEW mv_leak AS SELECT id, code, v FROM mv_leak_base;
CREATE UNIQUE INDEX ON mv_leak (code);
-- Control: direct DML is refused, as it must be.
DELETE FROM mv_leak WHERE id = 1;
ERROR:  cannot change materialized view "mv_leak"
SELECT count(*) AS rows_before FROM mv_leak;
 rows_before 
-------------
           3
(1 row)

-- Make two source rows collide on the arbiter index so the refresh CTE fails.
-- Failing here is correct; what matters is the state left behind.
UPDATE mv_leak_base SET code = 999 WHERE id IN (1, 2);
\set VERBOSITY terse
REFRESH MATERIALIZED VIEW mv_leak WHERE id <= 2;
ERROR:  ON CONFLICT DO UPDATE command cannot affect row a second time
\set VERBOSITY default
-- Both of these must still be refused, and the contents must be unchanged.
-- XXX currently both succeed.
DELETE FROM mv_leak WHERE id = 1;
ERROR:  cannot change materialized view "mv_leak"
INSERT INTO mv_leak (id, code, v) VALUES (42, 4242, 'injected');
ERROR:  cannot change materialized view "mv_leak"
SELECT * FROM mv_leak ORDER BY id;
 id | code | v 
----+------+---
  1 |  100 | a
  2 |  200 | b
  3 |  300 | c
(3 rows)

-- The exemption is not scoped to mv_leak either: every matview in the session
-- becomes writable, including one with no unique index at all.
-- XXX currently succeeds.
CREATE MATERIALIZED VIEW mv_leak_other AS SELECT id, v FROM mv_leak_base;
DELETE FROM mv_leak_other;
ERROR:  cannot change materialized view "mv_leak_other"
SELECT count(*) AS other_rows_after_delete FROM mv_leak_other;
 other_rows_after_delete 
-------------------------
                       3
(1 row)

DROP MATERIALIZED VIEW mv_leak_other;
DROP MATERIALIZED VIEW mv_leak;
DROP TABLE mv_leak_base;
