--
-- REFRESH MATERIALIZED VIEW ... WHERE ...
--
-- Tests 10 and up were added while reviewing the patch against the -hackers
-- thread "[Patch] Add WHERE clause support to REFRESH MATERIALIZED VIEW".  Each
-- one says whether it came from that thread or was found separately, so that
-- review items can be checked off against it.
--
-- Where a test covers a defect that is still unfixed, its expected output
-- describes what the command should do, so the test fails until the defect is
-- fixed, and an XXX comment names the behaviour seen today.
--
-- Each also carries a Disposition line saying whether it is worth keeping in the
-- tree once the defect is fixed, or is scaffolding to delete then.  Grep for
-- "Disposition:" across these files to review that at once.
--
-- Setup
CREATE TABLE mv_base_a (id int primary key, val text);
INSERT INTO mv_base_a VALUES (1, 'One'), (2, 'Two'), (3, 'Three');
CREATE MATERIALIZED VIEW mv_test_a AS SELECT * FROM mv_base_a;
CREATE UNIQUE INDEX ON mv_test_a(id);
--
-- Test 1: Syntax and Error handling
--
-- 1.1 WITH NO DATA + WHERE -> Error
REFRESH MATERIALIZED VIEW mv_test_a WITH NO DATA WHERE id = 1;
ERROR:  cannot specify WHERE clause with WITH NO DATA
-- 1.2 Unpopulated + WHERE -> Error
CREATE MATERIALIZED VIEW mv_unpop AS SELECT * FROM mv_base_a WITH NO DATA;
REFRESH MATERIALIZED VIEW mv_unpop WHERE id = 1;
ERROR:  WHERE clause cannot be used when the materialized view is not populated
DROP MATERIALIZED VIEW mv_unpop;
-- 1.3 Volatile functions -> Error
REFRESH MATERIALIZED VIEW mv_test_a WHERE random() > 0.5;
ERROR:  WHERE clause in REFRESH MATERIALIZED VIEW cannot contain volatile functions
-- 1.4 Aggregates -> Error
REFRESH MATERIALIZED VIEW mv_test_a WHERE count(*) > 0;
ERROR:  aggregate functions are not allowed in WHERE
--
-- Test 2: Non-concurrent Partial Refresh
--
-- Modify base data
UPDATE mv_base_a SET val = 'One Updated' WHERE id = 1;
UPDATE mv_base_a SET val = 'Two Updated' WHERE id = 2;
-- Refresh only id=1
REFRESH MATERIALIZED VIEW mv_test_a WHERE id = 1;
-- Verify: id=1 should be updated, id=2 should remain stale
SELECT * FROM mv_test_a ORDER BY id;
 id |     val     
----+-------------
  1 | One Updated
  2 | Two
  3 | Three
(3 rows)

-- Refresh id=2
REFRESH MATERIALIZED VIEW mv_test_a WHERE id = 2;
SELECT * FROM mv_test_a ORDER BY id;
 id |     val     
----+-------------
  1 | One Updated
  2 | Two Updated
  3 | Three
(3 rows)

--
-- Test 3: Concurrent Partial Refresh
--
-- Modify base data
UPDATE mv_base_a SET val = 'One Concurrent' WHERE id = 1;
UPDATE mv_base_a SET val = 'Two Concurrent' WHERE id = 2;
-- Refresh only id=1
REFRESH MATERIALIZED VIEW CONCURRENTLY mv_test_a WHERE id = 1;
-- Verify: id=1 updated, id=2 stale
SELECT * FROM mv_test_a ORDER BY id;
 id |      val       
----+----------------
  1 | One Concurrent
  2 | Two Updated
  3 | Three
(3 rows)

-- Refresh id=2
REFRESH MATERIALIZED VIEW CONCURRENTLY mv_test_a WHERE id = 2;
SELECT * FROM mv_test_a ORDER BY id;
 id |      val       
----+----------------
  1 | One Concurrent
  2 | Two Concurrent
  3 | Three
(3 rows)

-- Cleanup Test 2/3
DROP MATERIALIZED VIEW mv_test_a;
DROP TABLE mv_base_a;
--
-- Test 4: Join View (Invoice style)
--
CREATE TABLE invoices (id int primary key, total numeric);
CREATE TABLE invoice_items (inv_id int references invoices(id), amount numeric);
INSERT INTO invoices VALUES (1, 0), (2, 0);
INSERT INTO invoice_items VALUES (1, 100), (1, 50), (2, 200);
CREATE MATERIALIZED VIEW mv_invoices AS
  SELECT i.id, sum(ii.amount) as computed_total
  FROM invoices i
  JOIN invoice_items ii ON i.id = ii.inv_id
  GROUP BY i.id;
CREATE UNIQUE INDEX ON mv_invoices(id);
SELECT * FROM mv_invoices ORDER BY id;
 id | computed_total 
----+----------------
  1 |            150
  2 |            200
(2 rows)

-- Modify items for invoice 1
INSERT INTO invoice_items VALUES (1, 25);
-- Modify items for invoice 2
INSERT INTO invoice_items VALUES (2, 50);
-- Refresh only invoice 1
REFRESH MATERIALIZED VIEW mv_invoices WHERE id = 1;
-- Verify: Invoice 1 updated (175), Invoice 2 stale (200)
SELECT * FROM mv_invoices ORDER BY id;
 id | computed_total 
----+----------------
  1 |            175
  2 |            200
(2 rows)

-- Refresh invoice 2 concurrently
REFRESH MATERIALIZED VIEW CONCURRENTLY mv_invoices WHERE id = 2;
-- Verify: Invoice 2 updated (250)
SELECT * FROM mv_invoices ORDER BY id;
 id | computed_total 
----+----------------
  1 |            175
  2 |            250
(2 rows)

DROP MATERIALIZED VIEW mv_invoices;
DROP TABLE invoice_items;
DROP TABLE invoices;
--
-- Test 5: Rows entering/leaving view scope
--
CREATE TABLE items (id int, status text, val int);
INSERT INTO items VALUES (1, 'active', 10), (2, 'inactive', 20);
CREATE MATERIALIZED VIEW mv_active_items AS
  SELECT * FROM items WHERE status = 'active';
CREATE UNIQUE INDEX ON mv_active_items(id);
SELECT * FROM mv_active_items ORDER BY id;
 id | status | val 
----+--------+-----
  1 | active |  10
(1 row)

-- Case A: Row changes status active -> inactive (should be removed)
UPDATE items SET status = 'inactive' WHERE id = 1;
-- Also update row 2 to active (should be added)
UPDATE items SET status = 'active' WHERE id = 2;
-- Refresh partial WHERE id=1
-- Should remove id=1 because it no longer matches view definition
REFRESH MATERIALIZED VIEW mv_active_items WHERE id = 1;
SELECT * FROM mv_active_items ORDER BY id;
 id | status | val 
----+--------+-----
(0 rows)

-- Case B: Refresh to add row 2 (which is now active)
REFRESH MATERIALIZED VIEW mv_active_items WHERE id = 2;
SELECT * FROM mv_active_items ORDER BY id;
 id | status | val 
----+--------+-----
  2 | active |  20
(1 row)

-- Cleanup
DROP MATERIALIZED VIEW mv_active_items;
DROP TABLE items;
--
-- Test 6: Order of Operations (Value Swap)
-- Addressed specific worry: "The order of tuple processing matters"
--
CREATE TABLE mv_swap_base (id int primary key, code text);
INSERT INTO mv_swap_base VALUES (1, 'A'), (2, 'B');
CREATE MATERIALIZED VIEW mv_swap AS SELECT * FROM mv_swap_base;
CREATE UNIQUE INDEX ON mv_swap(code); -- Unique Index is on code, not ID
SELECT * FROM mv_swap ORDER BY id;
 id | code 
----+------
  1 | A
  2 | B
(2 rows)

-- Perform a swap in the base table
-- 1 becomes B, 2 becomes A
BEGIN;
UPDATE mv_swap_base SET code = 'TEMP' WHERE id = 1;
UPDATE mv_swap_base SET code = 'A' WHERE id = 2;
UPDATE mv_swap_base SET code = 'B' WHERE id = 1;
COMMIT;
-- Refresh both rows concurrently.
-- If the implementation inserts (1, 'B') before deleting (2, 'B'), this will fail.
-- It relies on the implementation correctly handling the Delete/Lock set before the Insert/Upsert.
REFRESH MATERIALIZED VIEW CONCURRENTLY mv_swap WHERE id IN (1, 2);
SELECT * FROM mv_swap ORDER BY id;
 id | code 
----+------
  1 | B
  2 | A
(2 rows)

DROP MATERIALIZED VIEW mv_swap;
DROP TABLE mv_swap_base;
--
-- Test 7: Scope Drift / Constraint Violation
-- Addressed specific worry: "If WHERE predicate would be different... UK violation couldn't be solved"
--
CREATE TABLE mv_drift_base (id int primary key, category_id int);
INSERT INTO mv_drift_base VALUES (1, 100), (2, 200);
CREATE MATERIALIZED VIEW mv_drift AS SELECT * FROM mv_drift_base;
-- KEY FIX: Index on ID, not Category.
-- We want to test that the Refresh logic detects ID conflicts when rows drift into scope,
-- not that Postgres enforces unique indexes on non-unique data.
CREATE UNIQUE INDEX ON mv_drift(id);
-- Update Row 1 to collide with Row 2's category
UPDATE mv_drift_base SET category_id = 200 WHERE id = 1;
-- Refresh using the NEW category value as the filter.
-- The View still contains (1, 100).
-- The Filter "category_id = 200" sees the NEW row (1, 200) in the base table.
-- The Filter "category_id = 200" does NOT see the OLD row (1, 100) in the View,
-- so nothing deletes it and the fresh row collides with it on 'id'.
-- Both refresh forms now resolve that collision in place instead of failing.
\set VERBOSITY terse
REFRESH MATERIALIZED VIEW CONCURRENTLY mv_drift WHERE category_id = 200;
\set VERBOSITY default
SELECT * FROM mv_drift ORDER BY id;
 id | category_id 
----+-------------
  1 |         200
  2 |         200
(2 rows)

-- Correct usage: Scope must include BOTH the Old location (100) and New location (200)
-- so the system sees the update as an update (or delete+insert).
REFRESH MATERIALIZED VIEW CONCURRENTLY mv_drift WHERE category_id IN (100, 200);
SELECT * FROM mv_drift ORDER BY id;
 id | category_id 
----+-------------
  1 |         200
  2 |         200
(2 rows)

DROP MATERIALIZED VIEW mv_drift;
DROP TABLE mv_drift_base;
--
-- Test 8: Multiple Unique Keys
-- Addressed specific worry: "what if we have multiple UKs?"
--
CREATE TABLE mv_multi_uk (id int primary key, email text, username text);
INSERT INTO mv_multi_uk VALUES (1, 'a@example.com', 'user_a');
CREATE MATERIALIZED VIEW mv_multi AS SELECT * FROM mv_multi_uk;
CREATE UNIQUE INDEX ON mv_multi(email);
CREATE UNIQUE INDEX ON mv_multi(username);
-- Update all columns
UPDATE mv_multi_uk SET email = 'b@example.com', username = 'user_b' WHERE id = 1;
-- Refresh should succeed updating all unique indexes
REFRESH MATERIALIZED VIEW CONCURRENTLY mv_multi WHERE id = 1;
SELECT * FROM mv_multi;
 id |     email     | username 
----+---------------+----------
  1 | b@example.com | user_b
(1 row)

DROP MATERIALIZED VIEW mv_multi;
DROP TABLE mv_multi_uk;
--
-- Test 9: Trigger-based Automatic Maintenance
-- Use Case: Automating the partial refresh via triggers using Arrays.
--
CREATE TABLE mv_trigger_base (id int primary key, val text);
CREATE MATERIALIZED VIEW mv_trigger_view AS SELECT * FROM mv_trigger_base;
CREATE UNIQUE INDEX ON mv_trigger_view(id);
-- Create a maintainer function
CREATE OR REPLACE FUNCTION maintain_mv_trigger_view() RETURNS TRIGGER AS $$
BEGIN
    IF (TG_OP IN ('INSERT', 'UPDATE')) THEN
        EXECUTE 'REFRESH MATERIALIZED VIEW mv_trigger_view WHERE id = ANY($1);'
            USING (SELECT array_agg(id) FROM new_table);
    END IF;

    IF (TG_OP IN ('DELETE')) THEN
        EXECUTE 'REFRESH MATERIALIZED VIEW mv_trigger_view WHERE id = ANY($1);'
            USING (SELECT array_agg(id) FROM old_table);
    END IF;

    RETURN NULL;
END;
$$ LANGUAGE plpgsql VOLATILE;
-- Trigger for Insert
CREATE TRIGGER t_refresh_mv_ins
    AFTER INSERT ON mv_trigger_base
    REFERENCING NEW TABLE AS new_table
    FOR EACH STATEMENT
EXECUTE FUNCTION maintain_mv_trigger_view();
-- Trigger for Update
CREATE TRIGGER t_refresh_mv_upd
    AFTER UPDATE ON mv_trigger_base
    REFERENCING NEW TABLE AS new_table
    FOR EACH STATEMENT
EXECUTE FUNCTION maintain_mv_trigger_view();
-- Trigger for Delete
CREATE TRIGGER t_refresh_mv_del
    AFTER DELETE ON mv_trigger_base
    REFERENCING OLD TABLE AS old_table
    FOR EACH STATEMENT
EXECUTE FUNCTION maintain_mv_trigger_view();
-- 1. Test Insert
INSERT INTO mv_trigger_base VALUES (1, 'Auto-Insert'), (2, 'Auto-Insert');
SELECT * FROM mv_trigger_view ORDER BY id;
 id |     val     
----+-------------
  1 | Auto-Insert
  2 | Auto-Insert
(2 rows)

-- 2. Test Update
UPDATE mv_trigger_base SET val = 'Auto-Update' WHERE id = 1;
SELECT * FROM mv_trigger_view ORDER BY id;
 id |     val     
----+-------------
  1 | Auto-Update
  2 | Auto-Insert
(2 rows)

-- 3. Test Delete
DELETE FROM mv_trigger_base WHERE id = 2;
SELECT * FROM mv_trigger_view ORDER BY id;
 id |     val     
----+-------------
  1 | Auto-Update
(1 row)

-- 4. Verify Transaction Isolation
-- Ensure that if the main transaction rolls back, the Refresh also rolls back
BEGIN;
INSERT INTO mv_trigger_base VALUES (99, 'Rollback');
SELECT * FROM mv_trigger_view WHERE id = 99; -- Should see it
 id |   val    
----+----------
 99 | Rollback
(1 row)

ROLLBACK;
SELECT * FROM mv_trigger_view WHERE id = 99; -- Should NOT see it
 id | val 
----+-----
(0 rows)

-- Cleanup
DROP MATERIALIZED VIEW mv_trigger_view;
DROP TABLE mv_trigger_base;
DROP FUNCTION maintain_mv_trigger_view();
--
-- Test 10: Unique index with INCLUDE columns
--
-- Reported on -hackers by Dharin Shah (repro test_include_bug.sql): the
-- ON CONFLICT target was built from indnatts, so INCLUDE columns landed in it
-- and the generated statement failed with "there is no unique or exclusion
-- constraint matching the ON CONFLICT specification".  Fixed by using
-- indnkeyatts; this is the regression guard, and it passes.
--
-- Disposition: keep.  Nothing else exercises an index with INCLUDE columns on
-- this path, and the cost is two refreshes.
--
CREATE TABLE mv_incl_base (id int primary key, extra text, v text);
INSERT INTO mv_incl_base VALUES (1, 'x', 'one'), (2, 'y', 'two');
CREATE MATERIALIZED VIEW mv_incl AS SELECT id, extra, v FROM mv_incl_base;
CREATE UNIQUE INDEX ON mv_incl(id) INCLUDE (extra);
-- Change both a plain column and the INCLUDE column, so that the DO UPDATE SET
-- list has to cover the INCLUDE column while the conflict target must not.
UPDATE mv_incl_base SET extra = 'x2', v = 'one-updated' WHERE id = 1;
REFRESH MATERIALIZED VIEW mv_incl WHERE id = 1;
SELECT * FROM mv_incl ORDER BY id;
 id | extra |      v      
----+-------+-------------
  1 | x2    | one-updated
  2 | y     | two
(2 rows)

-- The match/merge path builds its join quals from indnkeyatts as well.
UPDATE mv_incl_base SET extra = 'y2', v = 'two-updated' WHERE id = 2;
REFRESH MATERIALIZED VIEW CONCURRENTLY mv_incl WHERE id = 2;
SELECT * FROM mv_incl ORDER BY id;
 id | extra |      v      
----+-------+-------------
  1 | x2    | one-updated
  2 | y2    | two-updated
(2 rows)

DROP MATERIALIZED VIEW mv_incl;
DROP TABLE mv_incl_base;
--
-- Test 11: NULL values in the unique key column
--
-- Not yet reported on -hackers; found while writing these tests.
--
-- The direct-modification path resolves conflicts with ON CONFLICT, which
-- arbitrates via the unique index.  A NULLS DISTINCT index never reports a
-- conflict for a NULL key, so every row is inserted afresh.  The anti-join
-- that removes stale rows uses IS NOT DISTINCT FROM, which *does* treat two
-- NULLs as equal, so the pre-existing row is never removed.  The two halves
-- disagree, and rows accumulate.
--
-- Disposition: keep.  "A refresh that changes nothing changes nothing" is an
-- invariant worth asserting permanently, whichever way the disagreement is
-- resolved -- by matching the index's NULL semantics in the anti-join, or by
-- requiring NOT NULL or NULLS NOT DISTINCT key columns.
--
CREATE TABLE mv_null_base (id int, v text);
INSERT INTO mv_null_base VALUES (NULL, 'x'), (1, 'a');
CREATE MATERIALIZED VIEW mv_null AS SELECT id, v FROM mv_null_base;
CREATE UNIQUE INDEX ON mv_null(id);
SELECT count(*) AS rows_initial FROM mv_null;
 rows_initial 
--------------
            2
(1 row)

-- The base table is not modified, so each of these must be a no-op.
REFRESH MATERIALIZED VIEW mv_null WHERE id IS NULL;
REFRESH MATERIALIZED VIEW mv_null WHERE id IS NULL;
-- Must still be 2, and is: the anti-join now takes its NULL handling from the
-- arbiter index (B4), so the upsert and the anti-join agree that the
-- NULL-keyed row is unchanged.  Before that fix this returned 4 -- one
-- duplicate per refresh -- which is what the rest of this test is shaped
-- around.
SELECT count(*) AS rows_after_two_noop_refreshes FROM mv_null;
 rows_after_two_noop_refreshes 
-------------------------------
                             2
(1 row)

-- The match/merge path compares whole rows, so it is unaffected.
REFRESH MATERIALIZED VIEW CONCURRENTLY mv_null WHERE id IS NULL;
SELECT count(*) AS rows_after_concurrent_refresh FROM mv_null;
 rows_after_concurrent_refresh 
-------------------------------
                             2
(1 row)

-- With NULLS NOT DISTINCT the upsert does arbitrate on NULL, which agrees
-- with the anti-join, and the refresh behaves correctly.
CREATE MATERIALIZED VIEW mv_null_nnd AS SELECT id, v FROM mv_null_base;
CREATE UNIQUE INDEX ON mv_null_nnd(id) NULLS NOT DISTINCT;
SELECT count(*) AS rows_initial FROM mv_null_nnd;
 rows_initial 
--------------
            2
(1 row)

REFRESH MATERIALIZED VIEW mv_null_nnd WHERE id IS NULL;
REFRESH MATERIALIZED VIEW mv_null_nnd WHERE id IS NULL;
SELECT count(*) AS rows_after_two_noop_refreshes FROM mv_null_nnd;
 rows_after_two_noop_refreshes 
-------------------------------
                             2
(1 row)

DROP MATERIALIZED VIEW mv_null_nnd;
DROP MATERIALIZED VIEW mv_null;
DROP TABLE mv_null_base;
--
-- Test 12: Scope drift, direct-modification path
--
-- Reported on -hackers by Adam Brusselback, who wrote that "both the
-- direct-modification and match/merge paths resolve this by using an
-- INSERT ... ON CONFLICT DO UPDATE step (or DO NOTHING if there are no non-key
-- columns) against the arbiter index".  Both now do.
--
-- Note that CONCURRENTLY selects the direct-modification path and the bare
-- spelling selects match/merge; this exercises both on the same input.
--
-- Disposition: keep.  The two paths agreeing on the same input is an invariant.
--
CREATE TABLE mv_drift2_base (id int primary key, category_id int);
INSERT INTO mv_drift2_base VALUES (1, 100), (2, 200);
CREATE MATERIALIZED VIEW mv_drift2 AS SELECT id, category_id FROM mv_drift2_base;
CREATE UNIQUE INDEX ON mv_drift2(id);
-- Row 1 drifts from category 100 into category 200.  The predicate only sees
-- the new location, so the stale row at the old location is not deleted.
UPDATE mv_drift2_base SET category_id = 200 WHERE id = 1;
-- match/merge (bare spelling) absorbs the collision.
REFRESH MATERIALIZED VIEW mv_drift2 WHERE category_id = 200;
SELECT * FROM mv_drift2 ORDER BY id;
 id | category_id 
----+-------------
  1 |         200
  2 |         200
(2 rows)

-- The same drift through direct modification (CONCURRENTLY).
UPDATE mv_drift2_base SET category_id = 300 WHERE id = 1;
-- The VERBOSITY guard keeps any failure's diff to a single line: the CONTEXT of
-- a match/merge error names the transient tables, whose names are not stable
-- across runs.
\set VERBOSITY terse
REFRESH MATERIALIZED VIEW CONCURRENTLY mv_drift2 WHERE category_id = 300;
\set VERBOSITY default
SELECT * FROM mv_drift2 ORDER BY id;
 id | category_id 
----+-------------
  1 |         300
  2 |         200
(2 rows)

DROP MATERIALIZED VIEW mv_drift2;
DROP TABLE mv_drift2_base;
--
-- Test 13: What the predicate can reference
--
-- The subquery half was reported on -hackers by Dharin Shah, who noted that
-- the script claimed "Subqueries -> Error" while the expected output showed
-- none, and that nothing in transformRefreshWhereClause() forbids them.  The
-- comment has been removed; a schema-qualified subquery is allowed, and this
-- is the regression guard for that.
--
-- The unqualified half is not reported on -hackers.  REFRESH switches to the
-- matview's owner and calls RestrictSearchPath(), so the predicate is analyzed
-- with search_path set to "pg_catalog, pg_temp" and cannot see objects the
-- caller sees unqualified.  Unlike the other defects in this file, this one
-- records current behaviour rather than asserting a fix: restricting the path
-- is what makes the owner-privilege model tractable, so what should happen here
-- depends on how the privilege question is settled.
--
-- Disposition: keep both halves.  B9 is settled: the restricted search path
-- stays, because the predicate runs as the matview owner and a caller-supplied
-- search_path plus owner-context execution is the CVE-2018-1058 shape.  So the
-- schema-qualification requirement is real behaviour worth asserting, not a
-- record of something about to change.  What is still owed is a better error --
-- an errhint pointing at qualification rather than a bare "relation does not
-- exist".  Note that a Query-tree implementation may make this moot by letting
-- the predicate run as the invoker; if so, this becomes an assertion of the new
-- behaviour.
--
CREATE TABLE mv_sp_base (id int primary key, v text);
INSERT INTO mv_sp_base VALUES (1, 'one'), (2, 'two');
CREATE MATERIALIZED VIEW mv_sp AS SELECT id, v FROM mv_sp_base;
CREATE UNIQUE INDEX ON mv_sp(id);
CREATE TABLE mv_sp_ids (id int);
INSERT INTO mv_sp_ids VALUES (1);
SHOW search_path;
   search_path   
-----------------
 "$user", public
(1 row)

-- An unqualified reference fails even though "public" is in search_path.
REFRESH MATERIALIZED VIEW mv_sp WHERE id IN (SELECT id FROM mv_sp_ids);
ERROR:  relation "mv_sp_ids" does not exist
-- Schema-qualifying it works.
REFRESH MATERIALIZED VIEW mv_sp WHERE id IN (SELECT s.id FROM public.mv_sp_ids s);
SELECT * FROM mv_sp ORDER BY id;
 id |  v  
----+-----
  1 | one
  2 | two
(2 rows)

DROP TABLE mv_sp_ids;
DROP MATERIALIZED VIEW mv_sp;
DROP TABLE mv_sp_base;
--
-- Test 14: Which form of the command allows concurrent writers
--
-- Reported on -hackers by Vellaipandiyan: "The CONCURRENTLY behavior also feels
-- somewhat unintuitive here.  With WHERE refreshes, the non-CONCURRENT path
-- appears more permissive for writers than CONCURRENTLY WHERE, which seems
-- opposite to the expectation established by normal REFRESH MATERIALIZED VIEW
-- semantics."  Adam Brusselback agreed to swap the two paths, so that
-- CONCURRENTLY selects the direct-modification path and the bare form selects
-- match/merge.  That swap has since landed, so this test now records the agreed
-- behaviour rather than pinning a direction not yet taken.
--
-- What decides whether writers are blocked is the lock ExecRefreshMatView()
-- takes on the matview: match/merge takes ExclusiveLock, direct modification
-- takes only RowExclusiveLock.  Reading it back inside the refreshing
-- transaction is enough to tell which path ran.
--
-- Disposition: REPLACE.  The swap has landed, so the condition this test was
-- waiting on has fired -- and it asserts a lock level, which is the mechanism,
-- not "does a concurrent writer block", which is the guarantee.  An
-- implementation that blocks writers by some other means satisfies the
-- guarantee and fails this test, the same defect as Test 16 and the
-- pg_stat_statements block.
--
-- The behavioural replacement belongs in the isolation suite next to
-- matview-where-serialize, which already pins "readers never block"; what is
-- missing is "the bare form blocks a concurrent writer and CONCURRENTLY does
-- not".  Keep this until that exists.  See src/test/matview_where_stress/PLAN.md.
--
CREATE TABLE mv_lock_base (id int primary key, v text);
INSERT INTO mv_lock_base VALUES (1, 'one'), (2, 'two');
CREATE MATERIALIZED VIEW mv_lock AS SELECT id, v FROM mv_lock_base;
CREATE UNIQUE INDEX ON mv_lock(id);
-- CONCURRENTLY must be the permissive form: writers are not blocked.
-- XXX currently true, because CONCURRENTLY still selects match/merge.
BEGIN;
REFRESH MATERIALIZED VIEW CONCURRENTLY mv_lock WHERE id = 1;
SELECT bool_or(mode = 'ExclusiveLock') AS concurrently_blocks_writers
  FROM pg_locks
  WHERE locktype = 'relation' AND relation = 'mv_lock'::pg_catalog.regclass;
 concurrently_blocks_writers 
-----------------------------
 f
(1 row)

COMMIT;
-- The bare form must be the conservative one: writers are blocked.
-- XXX currently false, because the bare form still selects direct modification.
BEGIN;
REFRESH MATERIALIZED VIEW mv_lock WHERE id = 1;
SELECT bool_or(mode = 'ExclusiveLock') AS bare_where_blocks_writers
  FROM pg_locks
  WHERE locktype = 'relation' AND relation = 'mv_lock'::pg_catalog.regclass;
 bare_where_blocks_writers 
---------------------------
 t
(1 row)

COMMIT;
-- A full refresh is unaffected by the swap and keeps AccessExclusiveLock.
BEGIN;
REFRESH MATERIALIZED VIEW mv_lock;
SELECT bool_or(mode = 'AccessExclusiveLock') AS full_refresh_blocks_everything
  FROM pg_locks
  WHERE locktype = 'relation' AND relation = 'mv_lock'::pg_catalog.regclass;
 full_refresh_blocks_everything 
--------------------------------
 t
(1 row)

COMMIT;
DROP MATERIALIZED VIEW mv_lock;
DROP TABLE mv_lock_base;
--
-- Test 15: More than one unique index
--
-- Not yet reported on -hackers; found while writing these tests.  Test 8 above
-- covers a change that happens to arbitrate cleanly; this covers one that does
-- not.
--
-- The direct-modification path resolves collisions with ON CONFLICT against a
-- single arbiter index, so a row set that needs a delete before an insert to
-- satisfy a *second* unique index cannot be applied that way.  The diff/merge
-- path deletes before inserting and has no such limit, so the bare spelling is
-- the way to apply such a change.  This is a real capability difference between
-- the two forms rather than something either can fix, and it belongs in the
-- documentation.
--
-- Disposition: keep.  It pins which form can do what, and both halves matter.
--
CREATE TABLE mv_multi2_base (id int primary key, email text, uname text);
INSERT INTO mv_multi2_base VALUES (1, 'a@example.com', 'ua'),
                                 (2, 'b@example.com', 'ub');
CREATE MATERIALIZED VIEW mv_multi2 AS
  SELECT id, email, uname FROM mv_multi2_base;
CREATE UNIQUE INDEX ON mv_multi2(email);
CREATE UNIQUE INDEX ON mv_multi2(uname);
-- Swap the two email addresses.  Both the old and the new row set satisfy
-- every unique index, so a refresh has no reason to fail.
UPDATE mv_multi2_base SET email = CASE id WHEN 1 THEN 'b@example.com'
                                          ELSE 'a@example.com' END;
-- Direct modification cannot: it arbitrates on mv_multi2_email_idx and then
-- collides on mv_multi2_uname_idx.
\set VERBOSITY terse
REFRESH MATERIALIZED VIEW CONCURRENTLY mv_multi2 WHERE id IN (1, 2);
ERROR:  duplicate key value violates unique constraint "mv_multi2_uname_idx"
\set VERBOSITY default
SELECT * FROM mv_multi2 ORDER BY id;
 id |     email     | uname 
----+---------------+-------
  1 | a@example.com | ua
  2 | b@example.com | ub
(2 rows)

-- The diff/merge form deletes before inserting, so it applies the change.
REFRESH MATERIALIZED VIEW mv_multi2 WHERE id IN (1, 2);
SELECT * FROM mv_multi2 ORDER BY id;
 id |     email     | uname 
----+---------------+-------
  1 | b@example.com | ua
  2 | a@example.com | ub
(2 rows)

DROP MATERIALIZED VIEW mv_multi2;
DROP TABLE mv_multi2_base;
--
-- Test 16: the refresh inserts new rows in arbiter-key order
--
-- Found here, not on the -hackers thread.  The row-locking SELECT only covers
-- rows that ALREADY exist and match the predicate, so it says nothing about the
-- order the refresh takes locks in for rows it INSERTS.  Those are ordered by
-- the ORDER BY inside the fused CTE's new_data instead, and without it two
-- concurrent refreshes inserting the same new keys can take their speculative
-- insertion locks in opposite orders.
--
-- That ordering is observable without any concurrency: rows appended to the
-- matview land in the heap in the order the upsert touched them, so their
-- physical order is new_data's order.  Reading it back with ORDER BY ctid turns
-- a concurrency property into a deterministic single-session assertion.
--
-- Disposition: REPLACE.  This is a proxy, and it is worth being honest about
-- which.  The property is that two refreshes inserting the same new keys must
-- not deadlock; what is asserted here is physical order, which reveals that
-- property only while insertion order and lock order are the same thing.  An
-- implementation that acquires the locks separately, in order, and then inserts
-- in any order satisfies the property and fails this test.
--
-- The property-level replacement is two concurrent refreshes over overlapping
-- new keys, asserting no deadlock -- the shape matview_where_stress/run.sh
-- already uses for existing rows.  Keep this until that exists, as a cheap
-- smoke test.  See src/test/matview_where_stress/PLAN.md.
--
CREATE TABLE mv_iord_base (id int primary key, tag text, v int);
INSERT INTO mv_iord_base SELECT g, 'old', g FROM generate_series(1, 10) g;
CREATE MATERIALIZED VIEW mv_iord AS SELECT id, tag, v FROM mv_iord_base;
CREATE UNIQUE INDEX ON mv_iord(id);
-- Inserted descending, so the view query's heap order is the reverse of key
-- order and an unordered new_data would feed the upsert in that reverse order.
INSERT INTO mv_iord_base SELECT g, 'new', g FROM generate_series(20, 11, -1) g;
ANALYZE mv_iord_base;
ANALYZE mv_iord;
REFRESH MATERIALIZED VIEW CONCURRENTLY mv_iord WHERE tag = 'new';
-- Must be ascending.  Drop the ORDER BY from new_data and this comes back
-- {20,19,...,11}.
SELECT array_agg(id ORDER BY ctid) AS insert_order
  FROM mv_iord WHERE tag = 'new';
          insert_order           
---------------------------------
 {11,12,13,14,15,16,17,18,19,20}
(1 row)

DROP MATERIALIZED VIEW mv_iord;
DROP TABLE mv_iord_base;
