--
-- REFRESH MATERIALIZED VIEW ... WHERE ... : session plan cache
--
-- refresh_by_direct_modification() caches the two SPI plans it builds (the
-- row-locking SELECT and the fused upsert/delete CTE) in a session-level hash
-- table keyed on the matview OID.  An entry is reused when the arbiter index
-- OID and the deparsed WHERE clause text both match.
--
-- These tests all depend on cache state accumulated over the session, so they
-- live in their own file to keep that state predictable, and they must run in
-- the order written.
--
-- Every partial refresh here says CONCURRENTLY, and that is load-bearing rather
-- than stylistic.  RefreshMatViewByOid dispatches on `qual && concurrent`, so
-- only the CONCURRENTLY form reaches refresh_by_direct_modification() -- the one
-- path that caches anything.  The bare form goes to refresh_by_match_merge(),
-- which builds its SQL fresh on every call through matview_execute_spi().
-- These tests were written before commit 0607847 swapped which form takes which
-- path, and they were not updated with it, so for a while every one of them
-- exercised the uncached path: they asserted that a cached plan is invalidated
-- correctly, against a code path that caches no plans.  They passed, because
-- there was nothing there to break.  A test that cannot fail is not a guard.
--
-- None of the cases in this file were reported on -hackers; the plan cache had
-- not come up in the thread "[Patch] Add WHERE clause support to REFRESH
-- MATERIALIZED VIEW" at all.  They were found by reviewing the cache against
-- the plancache contract.
--
-- Every case here covered a live defect when it was written.  The expected
-- output has always described what the command should do, so each failed until
-- its defect was fixed; all of them are now fixed and the file is green.  Where
-- the pre-fix behaviour is worth knowing -- because it says what the test is
-- for -- the comment on the case says what used to happen.
--
-- Disposition: Tests 1 to 3 -- DELETE if the plan cache goes away.  All three
-- exist only because plans are cached across statements and revalidated by
-- re-analyzing a raw parse tree; drop the cache and they assert nothing.  If the
-- cache stays and gains proper invalidation, keep them as guards for it.
--
-- Disposition: Test 4 -- keep.  It asserts that a refresh acts on the rows its
-- predicate identifies, which holds however the plan is or is not cached.
--
--
-- Test 1: Renaming the materialized view
--
-- SPI_keepplan() saves the plan together with its raw parse tree.  When the
-- plan is invalidated it is re-analyzed from that raw tree, which resolves the
-- relation by name.  Renaming the matview does not change its OID, so the
-- cache entry is still considered valid, but the SQL inside it is not.
--
CREATE TABLE mv_c_base (id int primary key, v text);
INSERT INTO mv_c_base VALUES (1, 'one'), (2, 'two');
CREATE MATERIALIZED VIEW mv_c AS SELECT id, v FROM mv_c_base;
CREATE UNIQUE INDEX ON mv_c(id);
-- Warm the cache for this matview and this predicate.
REFRESH MATERIALIZED VIEW CONCURRENTLY mv_c WHERE id = 1;
ALTER MATERIALIZED VIEW mv_c RENAME TO mv_c_renamed;
UPDATE mv_c_base SET v = 'one-updated' WHERE id = 1;
-- Must succeed and pick up the new value.
REFRESH MATERIALIZED VIEW CONCURRENTLY mv_c_renamed WHERE id = 1;
SELECT * FROM mv_c_renamed ORDER BY id;
 id |      v      
----+-------------
  1 | one-updated
  2 | two
(2 rows)

--
-- Test 2: Another relation taking over the old name
--
-- Worse than an error: once something else occupies the name the cached plan
-- referred to, re-analysis silently resolves to that other relation.
--
CREATE TABLE mv_c_decoy_base (id int primary key, v text);
INSERT INTO mv_c_decoy_base VALUES (1, 'decoy-one'), (2, 'decoy-two');
-- This matview now owns the name "mv_c" that the cached plan refers to.
CREATE MATERIALIZED VIEW mv_c AS SELECT id, v FROM mv_c_decoy_base;
CREATE UNIQUE INDEX ON mv_c(id);
-- Refresh the *original* matview, by its current name.
REFRESH MATERIALIZED VIEW CONCURRENTLY mv_c_renamed WHERE id = 1;
-- The matview that was named is the one that moved.
SELECT * FROM mv_c_renamed ORDER BY id;
 id |      v      
----+-------------
  1 | one-updated
  2 | two
(2 rows)

-- ... and this one, which merely took over the name, is untouched.  Before the
-- fix the refresh wrote here instead, having taken no lock and no MAINTAIN
-- privilege check on it.
SELECT * FROM mv_c ORDER BY id;
 id |     v     
----+-----------
  1 | decoy-one
  2 | decoy-two
(2 rows)

DROP MATERIALIZED VIEW mv_c;
DROP TABLE mv_c_decoy_base;
DROP MATERIALIZED VIEW mv_c_renamed;
DROP TABLE mv_c_base;
--
-- Test 3: Renaming a base table
--
-- The cached refresh plan embeds pg_get_viewdef() output, so the same
-- re-analysis hazard applies to every relation the view definition names.
--
CREATE TABLE mv_c2_base (id int primary key, v text);
INSERT INTO mv_c2_base VALUES (1, 'real');
CREATE MATERIALIZED VIEW mv_c2 AS SELECT id, v FROM mv_c2_base;
CREATE UNIQUE INDEX ON mv_c2(id);
-- Warm the cache.
REFRESH MATERIALIZED VIEW CONCURRENTLY mv_c2 WHERE id = 1;
ALTER TABLE mv_c2_base RENAME TO mv_c2_base_old;
CREATE TABLE mv_c2_base (id int primary key, v text);
INSERT INTO mv_c2_base VALUES (1, 'decoy');
-- mv_c2 is still defined over mv_c2_base_old.
SELECT pg_get_viewdef('mv_c2'::pg_catalog.regclass);
     pg_get_viewdef      
-------------------------
  SELECT id,            +
     v                  +
    FROM mv_c2_base_old;
(1 row)

REFRESH MATERIALIZED VIEW CONCURRENTLY mv_c2 WHERE id = 1;
-- Filled from the table the view definition names, not from the one that took
-- over its name.
SELECT * FROM mv_c2 ORDER BY id;
 id |  v   
----+------
  1 | real
(1 row)

DROP MATERIALIZED VIEW mv_c2;
DROP TABLE mv_c2_base;
DROP TABLE mv_c2_base_old;
--
-- Test 4: Parameter types are not part of the cache key
--
-- pg_get_expr() renders an external parameter as "$1" with no type
-- information, so predicates that differ only in parameter type deparse
-- identically and share a cache entry.  The saved plan keeps the argument
-- types it was first prepared with.
--
CREATE TABLE mv_c3_base (id bigint primary key, v text);
INSERT INTO mv_c3_base VALUES (1, 'orig-small'), (4294967297, 'orig-large');
CREATE MATERIALIZED VIEW mv_c3 AS SELECT id, v FROM mv_c3_base;
CREATE UNIQUE INDEX ON mv_c3(id);
SELECT * FROM mv_c3 ORDER BY id;
     id     |     v      
------------+------------
          1 | orig-small
 4294967297 | orig-large
(2 rows)

-- Warm the cache with an int4 parameter.
DO $$ BEGIN
  EXECUTE 'REFRESH MATERIALIZED VIEW CONCURRENTLY mv_c3 WHERE id = $1' USING 1::int;
END $$;
UPDATE mv_c3_base SET v = 'new-small' WHERE id = 1;
UPDATE mv_c3_base SET v = 'new-large' WHERE id = 4294967297;
-- Same deparsed predicate, but an int8 parameter.  4294967297 has 1 in its low
-- 32 bits, so a plan expecting int4 reads the argument as 1.
DO $$ BEGIN
  EXECUTE 'REFRESH MATERIALIZED VIEW CONCURRENTLY mv_c3 WHERE id = $1' USING 4294967297::bigint;
END $$;
-- id = 4294967297 is the row that moved; id = 1 is untouched.  Before the fix
-- the int8 argument was read through a plan expecting int4 and the low 32 bits
-- selected row 1.
SELECT * FROM mv_c3 ORDER BY id;
     id     |     v      
------------+------------
          1 | orig-small
 4294967297 | new-large
(2 rows)

-- Reset to a known state with a full refresh, which takes neither the partial
-- path nor its cache, then confirm the fix holds for a second call on the same
-- warmed entry rather than only for the first one after it.
REFRESH MATERIALIZED VIEW mv_c3;
UPDATE mv_c3_base SET v = 'concurrent-large' WHERE id = 4294967297;
DO $$ BEGIN
  EXECUTE 'REFRESH MATERIALIZED VIEW CONCURRENTLY mv_c3 WHERE id = $1'
    USING 4294967297::bigint;
END $$;
SELECT * FROM mv_c3 ORDER BY id;
     id     |        v         
------------+------------------
          1 | new-small
 4294967297 | concurrent-large
(2 rows)

DROP MATERIALIZED VIEW mv_c3;
DROP TABLE mv_c3_base;
