--
-- REFRESH MATERIALIZED VIEW ... WHERE ...
--
-- What a partial refresh does: which rows the condition selects, which it
-- leaves alone, and what the command refuses.
--
-- Each case covered a live defect when it was written, and the expected output
-- describes what the command should do, so each one failed until its defect was
-- fixed.  Where the pre-fix behaviour says what the case is for, the comment on
-- the case records it.
--
-- Setup
CREATE TABLE mv_base_a (id int primary key, val text);
INSERT INTO mv_base_a VALUES (1, 'One'), (2, 'Two'), (3, 'Three');
CREATE MATERIALIZED VIEW mv_test_a AS SELECT * FROM mv_base_a;
CREATE UNIQUE INDEX ON mv_test_a(id);
--
-- Test 1: Syntax and Error handling
--
-- 1.1 WHERE without CONCURRENTLY -> Error.  A partial refresh modifies rows in
-- place, which is what CONCURRENTLY selects; the bare form replaces the
-- matview's contents wholesale and has no way to restrict that to a scope.
REFRESH MATERIALIZED VIEW mv_test_a WHERE id = 1;
ERROR:  cannot specify WHERE clause without CONCURRENTLY
LINE 1: REFRESH MATERIALIZED VIEW mv_test_a WHERE id = 1;
                                            ^
DETAIL:  A partial refresh modifies rows in place; the non-concurrent form replaces the materialized view's contents entirely.
-- 1.2 WITH NO DATA + WHERE -> Error
REFRESH MATERIALIZED VIEW CONCURRENTLY mv_test_a WITH NO DATA WHERE id = 1;
ERROR:  cannot specify WHERE clause with WITH NO DATA
LINE 1: ...RIALIZED VIEW CONCURRENTLY mv_test_a WITH NO DATA WHERE id =...
                                                             ^
-- 1.3 Unpopulated + WHERE -> Error
CREATE MATERIALIZED VIEW mv_unpop AS SELECT * FROM mv_base_a WITH NO DATA;
REFRESH MATERIALIZED VIEW CONCURRENTLY mv_unpop WHERE id = 1;
ERROR:  CONCURRENTLY cannot be used when the materialized view is not populated
DROP MATERIALIZED VIEW mv_unpop;
-- 1.4 Volatile functions -> Error
REFRESH MATERIALIZED VIEW CONCURRENTLY mv_test_a WHERE random() > 0.5;
ERROR:  WHERE clause in REFRESH MATERIALIZED VIEW cannot contain volatile functions
-- 1.5 Aggregates -> Error
REFRESH MATERIALIZED VIEW CONCURRENTLY mv_test_a WHERE count(*) > 0;
ERROR:  aggregate functions are not allowed in WHERE
CONTEXT:  WHERE clause of REFRESH MATERIALIZED VIEW
--
-- Test 2: only the rows the predicate names are refreshed
--
-- Modify base data
UPDATE mv_base_a SET val = 'One Updated' WHERE id = 1;
UPDATE mv_base_a SET val = 'Two Updated' WHERE id = 2;
-- Refresh only id=1
REFRESH MATERIALIZED VIEW CONCURRENTLY mv_test_a WHERE id = 1;
-- Verify: id=1 should be updated, id=2 should remain stale
SELECT * FROM mv_test_a ORDER BY id;
 id |     val     
----+-------------
  1 | One Updated
  2 | Two
  3 | Three
(3 rows)

-- Refresh id=2
REFRESH MATERIALIZED VIEW CONCURRENTLY mv_test_a WHERE id = 2;
SELECT * FROM mv_test_a ORDER BY id;
 id |     val     
----+-------------
  1 | One Updated
  2 | Two Updated
  3 | Three
(3 rows)

--
-- Test 3: a later refresh of the same rows picks up the newer values
--
-- The pair used to be the two forms, before a WHERE clause required
-- CONCURRENTLY.  Kept as a second round rather than deleted: it is the only
-- case that refreshes a scope twice from one session with different data both
-- times, which is what a cached plan serving a stale answer would break.
--
-- Modify base data
UPDATE mv_base_a SET val = 'One Concurrent' WHERE id = 1;
UPDATE mv_base_a SET val = 'Two Concurrent' WHERE id = 2;
-- Refresh only id=1
REFRESH MATERIALIZED VIEW CONCURRENTLY mv_test_a WHERE id = 1;
-- Verify: id=1 updated, id=2 stale
SELECT * FROM mv_test_a ORDER BY id;
 id |      val       
----+----------------
  1 | One Concurrent
  2 | Two Updated
  3 | Three
(3 rows)

-- Refresh id=2
REFRESH MATERIALIZED VIEW CONCURRENTLY mv_test_a WHERE id = 2;
SELECT * FROM mv_test_a ORDER BY id;
 id |      val       
----+----------------
  1 | One Concurrent
  2 | Two Concurrent
  3 | Three
(3 rows)

-- Cleanup Test 2/3
DROP MATERIALIZED VIEW mv_test_a;
DROP TABLE mv_base_a;
--
-- Test 4: Join View (Invoice style)
--
CREATE TABLE invoices (id int primary key, total numeric);
CREATE TABLE invoice_items (inv_id int references invoices(id), amount numeric);
INSERT INTO invoices VALUES (1, 0), (2, 0);
INSERT INTO invoice_items VALUES (1, 100), (1, 50), (2, 200);
CREATE MATERIALIZED VIEW mv_invoices AS
  SELECT i.id, sum(ii.amount) as computed_total
  FROM invoices i
  JOIN invoice_items ii ON i.id = ii.inv_id
  GROUP BY i.id;
CREATE UNIQUE INDEX ON mv_invoices(id);
SELECT * FROM mv_invoices ORDER BY id;
 id | computed_total 
----+----------------
  1 |            150
  2 |            200
(2 rows)

-- Modify items for invoice 1
INSERT INTO invoice_items VALUES (1, 25);
-- Modify items for invoice 2
INSERT INTO invoice_items VALUES (2, 50);
-- Refresh only invoice 1
REFRESH MATERIALIZED VIEW CONCURRENTLY mv_invoices WHERE id = 1;
-- Verify: Invoice 1 updated (175), Invoice 2 stale (200)
SELECT * FROM mv_invoices ORDER BY id;
 id | computed_total 
----+----------------
  1 |            175
  2 |            200
(2 rows)

-- Refresh invoice 2 concurrently
REFRESH MATERIALIZED VIEW CONCURRENTLY mv_invoices WHERE id = 2;
-- Verify: Invoice 2 updated (250)
SELECT * FROM mv_invoices ORDER BY id;
 id | computed_total 
----+----------------
  1 |            175
  2 |            250
(2 rows)

DROP MATERIALIZED VIEW mv_invoices;
DROP TABLE invoice_items;
DROP TABLE invoices;
--
-- Test 5: Rows entering/leaving view scope
--
CREATE TABLE items (id int, status text, val int);
INSERT INTO items VALUES (1, 'active', 10), (2, 'inactive', 20);
CREATE MATERIALIZED VIEW mv_active_items AS
  SELECT * FROM items WHERE status = 'active';
CREATE UNIQUE INDEX ON mv_active_items(id);
SELECT * FROM mv_active_items ORDER BY id;
 id | status | val 
----+--------+-----
  1 | active |  10
(1 row)

-- Case A: Row changes status active -> inactive (should be removed)
UPDATE items SET status = 'inactive' WHERE id = 1;
-- Also update row 2 to active (should be added)
UPDATE items SET status = 'active' WHERE id = 2;
-- Refresh partial WHERE id=1
-- Should remove id=1 because it no longer matches view definition
REFRESH MATERIALIZED VIEW CONCURRENTLY mv_active_items WHERE id = 1;
SELECT * FROM mv_active_items ORDER BY id;
 id | status | val 
----+--------+-----
(0 rows)

-- Case B: Refresh to add row 2 (which is now active)
REFRESH MATERIALIZED VIEW CONCURRENTLY mv_active_items WHERE id = 2;
SELECT * FROM mv_active_items ORDER BY id;
 id | status | val 
----+--------+-----
  2 | active |  20
(1 row)

-- Cleanup
DROP MATERIALIZED VIEW mv_active_items;
DROP TABLE items;
--
-- Test 6: Order of Operations (Value Swap)
-- Addressed specific worry: "The order of tuple processing matters"
--
CREATE TABLE mv_swap_base (id int primary key, code text);
INSERT INTO mv_swap_base VALUES (1, 'A'), (2, 'B');
CREATE MATERIALIZED VIEW mv_swap AS SELECT * FROM mv_swap_base;
CREATE UNIQUE INDEX ON mv_swap(code); -- Unique Index is on code, not ID
SELECT * FROM mv_swap ORDER BY id;
 id | code 
----+------
  1 | A
  2 | B
(2 rows)

-- Perform a swap in the base table
-- 1 becomes B, 2 becomes A
BEGIN;
UPDATE mv_swap_base SET code = 'TEMP' WHERE id = 1;
UPDATE mv_swap_base SET code = 'A' WHERE id = 2;
UPDATE mv_swap_base SET code = 'B' WHERE id = 1;
COMMIT;
-- Refresh both rows concurrently.
-- If the implementation inserts (1, 'B') before deleting (2, 'B'), this will fail.
-- It relies on the implementation correctly handling the Delete/Lock set before the Insert/Upsert.
REFRESH MATERIALIZED VIEW CONCURRENTLY mv_swap WHERE id IN (1, 2);
SELECT * FROM mv_swap ORDER BY id;
 id | code 
----+------
  1 | B
  2 | A
(2 rows)

DROP MATERIALIZED VIEW mv_swap;
DROP TABLE mv_swap_base;
--
-- Test 7: Scope Drift / Constraint Violation
-- Addressed specific worry: "If WHERE predicate would be different... UK violation couldn't be solved"
--
CREATE TABLE mv_drift_base (id int primary key, category_id int);
INSERT INTO mv_drift_base VALUES (1, 100), (2, 200);
CREATE MATERIALIZED VIEW mv_drift AS SELECT * FROM mv_drift_base;
-- KEY FIX: Index on ID, not Category.
-- We want to test that the Refresh logic detects ID conflicts when rows drift into scope,
-- not that Postgres enforces unique indexes on non-unique data.
CREATE UNIQUE INDEX ON mv_drift(id);
-- Update Row 1 to collide with Row 2's category
UPDATE mv_drift_base SET category_id = 200 WHERE id = 1;
-- Refresh using the NEW category value as the filter.
-- The View still contains (1, 100).
-- The Filter "category_id = 200" sees the NEW row (1, 200) in the base table.
-- The Filter "category_id = 200" does NOT see the OLD row (1, 100) in the View,
-- so nothing deletes it and the fresh row collides with it on 'id'.
-- Both refresh forms now resolve that collision in place instead of failing.
\set VERBOSITY terse
REFRESH MATERIALIZED VIEW CONCURRENTLY mv_drift WHERE category_id = 200;
\set VERBOSITY default
SELECT * FROM mv_drift ORDER BY id;
 id | category_id 
----+-------------
  1 |         200
  2 |         200
(2 rows)

-- Correct usage: Scope must include BOTH the Old location (100) and New location (200)
-- so the system sees the update as an update (or delete+insert).
REFRESH MATERIALIZED VIEW CONCURRENTLY mv_drift WHERE category_id IN (100, 200);
SELECT * FROM mv_drift ORDER BY id;
 id | category_id 
----+-------------
  1 |         200
  2 |         200
(2 rows)

DROP MATERIALIZED VIEW mv_drift;
DROP TABLE mv_drift_base;
--
-- Test 8: Multiple Unique Keys
-- Addressed specific worry: "what if we have multiple UKs?"
--
-- A partial refresh applies its changes with ON CONFLICT against a single
-- arbiter index, so a row set that needs a delete before an insert to satisfy a
-- *second* unique index cannot be applied that way.  No choice of arbiter
-- avoids it: whichever unique index arbitrates, a swap collides on the other
-- one.  A WHERE clause is therefore refused outright on a matview carrying more
-- than one unique index, rather than failing partway through on whichever
-- change it cannot express.
--
-- It pins the precondition in both directions, the refusal and the same
-- command succeeding once the extra index is gone, and
-- it is the case that would notice if a future statement shape (a scoped delete
-- before the insert, say) let the upsert express this after all, at which point
-- the restriction can be lifted without breaking anyone.
--
CREATE TABLE mv_multi_base (id int primary key, email text, uname text);
INSERT INTO mv_multi_base VALUES (1, 'a@example.com', 'ua'),
                                 (2, 'b@example.com', 'ub');
CREATE MATERIALIZED VIEW mv_multi AS
  SELECT id, email, uname FROM mv_multi_base;
CREATE UNIQUE INDEX ON mv_multi(email);
CREATE UNIQUE INDEX ON mv_multi(uname);
-- Swap the two email addresses.  Both the old and the new row set satisfy every
-- unique index, so nothing about the data is wrong; it is the upsert that
-- cannot get from one to the other.
UPDATE mv_multi_base SET email = CASE id WHEN 1 THEN 'b@example.com'
                                         ELSE 'a@example.com' END;
-- Refused, because of the second unique index.
REFRESH MATERIALIZED VIEW CONCURRENTLY mv_multi WHERE id IN (1, 2);
ERROR:  cannot refresh materialized view "public.mv_multi" with a WHERE clause
DETAIL:  A partial refresh applies its changes against a single unique index, and the materialized view has more than one.
HINT:  Refresh the materialized view without a WHERE clause.
-- The matview is untouched by the refusal: it still holds the pre-swap rows.
SELECT * FROM mv_multi ORDER BY id;
 id |     email     | uname 
----+---------------+-------
  1 | a@example.com | ua
  2 | b@example.com | ub
(2 rows)

-- A full refresh has no such limit, and applies the swap.
REFRESH MATERIALIZED VIEW CONCURRENTLY mv_multi;
SELECT * FROM mv_multi ORDER BY id;
 id |     email     | uname 
----+---------------+-------
  1 | b@example.com | ua
  2 | a@example.com | ub
(2 rows)

-- Drop the second unique index and a partial refresh takes it, and still
-- applies a swap, because with only the arbiter left there is nothing to
-- collide with: the upsert matches each row by the very column being swapped
-- and updates it in place.  The collision needs a unique index that is NOT the
-- arbiter, which needs a second one.  So the restriction above is specific
-- rather than a blanket refusal of predicates on this matview, and the answer
-- to the question this case was written for is that a change touching several
-- unique keys at once is applied correctly whenever it can be applied at all.
DROP INDEX mv_multi_uname_idx;
UPDATE mv_multi_base SET email = CASE id WHEN 1 THEN 'a@example.com'
                                         ELSE 'b@example.com' END;
REFRESH MATERIALIZED VIEW CONCURRENTLY mv_multi WHERE id IN (1, 2);
SELECT * FROM mv_multi ORDER BY id;
 id |     email     | uname 
----+---------------+-------
  1 | a@example.com | ua
  2 | b@example.com | ub
(2 rows)

DROP MATERIALIZED VIEW mv_multi;
DROP TABLE mv_multi_base;
--
-- Test 9: Trigger-based Automatic Maintenance
-- Use Case: Automating the partial refresh via triggers using Arrays.
--
CREATE TABLE mv_trigger_base (id int primary key, val text);
CREATE MATERIALIZED VIEW mv_trigger_view AS SELECT * FROM mv_trigger_base;
CREATE UNIQUE INDEX ON mv_trigger_view(id);
-- Create a maintainer function
CREATE OR REPLACE FUNCTION maintain_mv_trigger_view() RETURNS TRIGGER AS $$
BEGIN
    IF (TG_OP IN ('INSERT', 'UPDATE')) THEN
        EXECUTE 'REFRESH MATERIALIZED VIEW CONCURRENTLY mv_trigger_view WHERE id = ANY($1);'
            USING (SELECT array_agg(id) FROM new_table);
    END IF;

    IF (TG_OP IN ('DELETE')) THEN
        EXECUTE 'REFRESH MATERIALIZED VIEW CONCURRENTLY mv_trigger_view WHERE id = ANY($1);'
            USING (SELECT array_agg(id) FROM old_table);
    END IF;

    RETURN NULL;
END;
$$ LANGUAGE plpgsql VOLATILE;
-- Trigger for Insert
CREATE TRIGGER t_refresh_mv_ins
    AFTER INSERT ON mv_trigger_base
    REFERENCING NEW TABLE AS new_table
    FOR EACH STATEMENT
EXECUTE FUNCTION maintain_mv_trigger_view();
-- Trigger for Update
CREATE TRIGGER t_refresh_mv_upd
    AFTER UPDATE ON mv_trigger_base
    REFERENCING NEW TABLE AS new_table
    FOR EACH STATEMENT
EXECUTE FUNCTION maintain_mv_trigger_view();
-- Trigger for Delete
CREATE TRIGGER t_refresh_mv_del
    AFTER DELETE ON mv_trigger_base
    REFERENCING OLD TABLE AS old_table
    FOR EACH STATEMENT
EXECUTE FUNCTION maintain_mv_trigger_view();
-- 1. Test Insert
INSERT INTO mv_trigger_base VALUES (1, 'Auto-Insert'), (2, 'Auto-Insert');
SELECT * FROM mv_trigger_view ORDER BY id;
 id |     val     
----+-------------
  1 | Auto-Insert
  2 | Auto-Insert
(2 rows)

-- 2. Test Update
UPDATE mv_trigger_base SET val = 'Auto-Update' WHERE id = 1;
SELECT * FROM mv_trigger_view ORDER BY id;
 id |     val     
----+-------------
  1 | Auto-Update
  2 | Auto-Insert
(2 rows)

-- 3. Test Delete
DELETE FROM mv_trigger_base WHERE id = 2;
SELECT * FROM mv_trigger_view ORDER BY id;
 id |     val     
----+-------------
  1 | Auto-Update
(1 row)

-- 4. Verify Transaction Isolation
-- Ensure that if the main transaction rolls back, the Refresh also rolls back
BEGIN;
INSERT INTO mv_trigger_base VALUES (99, 'Rollback');
SELECT * FROM mv_trigger_view WHERE id = 99; -- Should see it
 id |   val    
----+----------
 99 | Rollback
(1 row)

ROLLBACK;
SELECT * FROM mv_trigger_view WHERE id = 99; -- Should NOT see it
 id | val 
----+-----
(0 rows)

-- Cleanup
DROP MATERIALIZED VIEW mv_trigger_view;
DROP TABLE mv_trigger_base;
DROP FUNCTION maintain_mv_trigger_view();
--
-- Test 10: Unique index with INCLUDE columns
--
-- Reported by Dharin Shah: the
-- ON CONFLICT target was built from indnatts, so INCLUDE columns landed in it
-- and the generated statement failed with "there is no unique or exclusion
-- constraint matching the ON CONFLICT specification".  Fixed by using
-- indnkeyatts; this is the regression guard, and it passes.
--
-- Nothing else exercises an index with INCLUDE columns on this path.
--
CREATE TABLE mv_incl_base (id int primary key, extra text, v text);
INSERT INTO mv_incl_base VALUES (1, 'x', 'one'), (2, 'y', 'two');
CREATE MATERIALIZED VIEW mv_incl AS SELECT id, extra, v FROM mv_incl_base;
CREATE UNIQUE INDEX ON mv_incl(id) INCLUDE (extra);
-- Change both a plain column and the INCLUDE column, so that the DO UPDATE SET
-- list has to cover the INCLUDE column while the conflict target must not.
UPDATE mv_incl_base SET extra = 'x2', v = 'one-updated' WHERE id = 1;
REFRESH MATERIALIZED VIEW CONCURRENTLY mv_incl WHERE id = 1;
SELECT * FROM mv_incl ORDER BY id;
 id | extra |      v      
----+-------+-------------
  1 | x2    | one-updated
  2 | y     | two
(2 rows)

-- Again for a second row, so a fix that happened to suit the first one shows.
UPDATE mv_incl_base SET extra = 'y2', v = 'two-updated' WHERE id = 2;
REFRESH MATERIALIZED VIEW CONCURRENTLY mv_incl WHERE id = 2;
SELECT * FROM mv_incl ORDER BY id;
 id | extra |      v      
----+-------+-------------
  1 | x2    | one-updated
  2 | y2    | two-updated
(2 rows)

DROP MATERIALIZED VIEW mv_incl;
DROP TABLE mv_incl_base;
--
-- Test 11: NULL values in the unique key column
--
-- The direct-modification path resolves conflicts with ON CONFLICT, which
-- arbitrates via the unique index.  A NULLS DISTINCT index never reports a
-- conflict for a NULL key, so every row is inserted afresh.  The anti-join
-- that removes stale rows uses IS NOT DISTINCT FROM, which *does* treat two
-- NULLs as equal, so the pre-existing row is never removed.  The two halves
-- disagree, and rows accumulate.
--
-- "A refresh that changes nothing changes nothing" is worth asserting whichever
-- way the disagreement is resolved, either by matching the index's NULL
-- semantics in the anti-join or by requiring NOT NULL or NULLS NOT DISTINCT key
-- columns.
--
CREATE TABLE mv_null_base (id int, v text);
INSERT INTO mv_null_base VALUES (NULL, 'x'), (1, 'a');
CREATE MATERIALIZED VIEW mv_null AS SELECT id, v FROM mv_null_base;
CREATE UNIQUE INDEX ON mv_null(id);
SELECT count(*) AS rows_initial FROM mv_null;
 rows_initial 
--------------
            2
(1 row)

-- The base table is not modified, so each of these must be a no-op.
REFRESH MATERIALIZED VIEW CONCURRENTLY mv_null WHERE id IS NULL;
REFRESH MATERIALIZED VIEW CONCURRENTLY mv_null WHERE id IS NULL;
-- Must still be 2, and is: the anti-join now takes its NULL handling from the
-- arbiter index, so the upsert and the anti-join agree that the
-- NULL-keyed row is unchanged.  Before that fix this returned 4, one
-- duplicate per refresh, which is what the rest of this test is shaped
-- around.
SELECT count(*) AS rows_after_two_noop_refreshes FROM mv_null;
 rows_after_two_noop_refreshes 
-------------------------------
                             2
(1 row)

-- And again, so a repair that only held for the first refresh would show.
REFRESH MATERIALIZED VIEW CONCURRENTLY mv_null WHERE id IS NULL;
SELECT count(*) AS rows_after_concurrent_refresh FROM mv_null;
 rows_after_concurrent_refresh 
-------------------------------
                             2
(1 row)

-- With NULLS NOT DISTINCT the upsert does arbitrate on NULL, which agrees
-- with the anti-join, and the refresh behaves correctly.
CREATE MATERIALIZED VIEW mv_null_nnd AS SELECT id, v FROM mv_null_base;
CREATE UNIQUE INDEX ON mv_null_nnd(id) NULLS NOT DISTINCT;
SELECT count(*) AS rows_initial FROM mv_null_nnd;
 rows_initial 
--------------
            2
(1 row)

REFRESH MATERIALIZED VIEW CONCURRENTLY mv_null_nnd WHERE id IS NULL;
REFRESH MATERIALIZED VIEW CONCURRENTLY mv_null_nnd WHERE id IS NULL;
SELECT count(*) AS rows_after_two_noop_refreshes FROM mv_null_nnd;
 rows_after_two_noop_refreshes 
-------------------------------
                             2
(1 row)

DROP MATERIALIZED VIEW mv_null_nnd;
DROP MATERIALIZED VIEW mv_null;
DROP TABLE mv_null_base;
--
-- Test 12: Scope drift
--
-- The refresh resolves this with an INSERT ... ON CONFLICT DO UPDATE against
-- the arbiter index, or DO NOTHING when there are no non-key columns.
--
-- A row drifting into the predicate's scope while a stale copy of it sits
-- outside is what the arbiter index exists to reconcile.  Getting it wrong is a
-- duplicate key violation rather than a wrong answer, so it fails loudly.
--
CREATE TABLE mv_drift2_base (id int primary key, category_id int);
INSERT INTO mv_drift2_base VALUES (1, 100), (2, 200);
CREATE MATERIALIZED VIEW mv_drift2 AS SELECT id, category_id FROM mv_drift2_base;
CREATE UNIQUE INDEX ON mv_drift2(id);
-- Row 1 drifts from category 100 into category 200.  The predicate only sees
-- the new location, so the stale row at the old location is not deleted.
UPDATE mv_drift2_base SET category_id = 200 WHERE id = 1;
-- The upsert absorbs the collision: it matches the stale row by its key,
-- whatever the predicate column says, and overwrites it in place.
REFRESH MATERIALIZED VIEW CONCURRENTLY mv_drift2 WHERE category_id = 200;
SELECT * FROM mv_drift2 ORDER BY id;
 id | category_id 
----+-------------
  1 |         200
  2 |         200
(2 rows)

-- The same drift a second time, to a category no row has held.
UPDATE mv_drift2_base SET category_id = 300 WHERE id = 1;
-- The VERBOSITY guard keeps any failure's diff to a single line: the CONTEXT of
-- a failure here is the whole generated statement, which is long and carries
-- names that are not stable across runs.
\set VERBOSITY terse
REFRESH MATERIALIZED VIEW CONCURRENTLY mv_drift2 WHERE category_id = 300;
\set VERBOSITY default
SELECT * FROM mv_drift2 ORDER BY id;
 id | category_id 
----+-------------
  1 |         300
  2 |         200
(2 rows)

DROP MATERIALIZED VIEW mv_drift2;
DROP TABLE mv_drift2_base;
--
-- Test 13: What the predicate can reference
--
-- The subquery half was reported by Dharin Shah, who noted that
-- the script claimed "Subqueries -> Error" while the expected output showed
-- none, and that nothing in transformRefreshWhereClause() forbids them.  The
-- comment has been removed; a schema-qualified subquery is allowed, and this
-- is the regression guard for that.
--
-- REFRESH switches to the
-- matview's owner and calls RestrictSearchPath(), so the predicate is analyzed
-- with search_path set to "pg_catalog, pg_temp" and cannot see objects the
-- caller sees unqualified.  Unlike the other defects in this file, this one
-- records current behaviour rather than asserting a fix: restricting the path
-- is what makes the owner-privilege model tractable, so what should happen here
-- depends on how the privilege question is settled.
--
-- Both halves matter.  The restricted search path stays, because the predicate
-- runs as the matview owner and a caller-supplied search_path plus
-- owner-context execution is the CVE-2018-1058 shape.  So the
-- schema-qualification requirement is real behaviour worth asserting, not a
-- record of something about to change.  The bare "relation does not exist" that
-- used to be all a caller got now carries an error context and, for the errors a
-- missing qualification actually produces, a hint naming the restricted
-- search_path, which is what the expected output below pins.
--
CREATE TABLE mv_sp_base (id int primary key, v text);
INSERT INTO mv_sp_base VALUES (1, 'one'), (2, 'two');
CREATE MATERIALIZED VIEW mv_sp AS SELECT id, v FROM mv_sp_base;
CREATE UNIQUE INDEX ON mv_sp(id);
CREATE TABLE mv_sp_ids (id int);
INSERT INTO mv_sp_ids VALUES (1);
SHOW search_path;
   search_path   
-----------------
 "$user", public
(1 row)

-- An unqualified reference fails even though "public" is in search_path.
REFRESH MATERIALIZED VIEW CONCURRENTLY mv_sp WHERE id IN (SELECT id FROM mv_sp_ids);
ERROR:  relation "mv_sp_ids" does not exist
HINT:  The condition is analyzed with search_path set to "pg_catalog, pg_temp", so it must schema-qualify the objects it names.
CONTEXT:  WHERE clause of REFRESH MATERIALIZED VIEW
-- Schema-qualifying it works.
REFRESH MATERIALIZED VIEW CONCURRENTLY mv_sp WHERE id IN (SELECT s.id FROM public.mv_sp_ids s);
SELECT * FROM mv_sp ORDER BY id;
 id |  v  
----+-----
  1 | one
  2 | two
(2 rows)

-- A CORRELATED subquery, which is the case the uncorrelated one above cannot
-- reach.  The predicate is deparsed back to text for the statements SPI builds,
-- and ruleutils only qualifies a Var once something else is in scope, which a
-- subquery referring back to the matview is the first thing to do.  If the
-- deparse names the matview differently from the way those statements do, this
-- is where it shows up, as "missing FROM-clause entry".  Both halves of the
-- statement carry the predicate, so both would fail.
UPDATE mv_sp_base SET v = 'ONE' WHERE id = 1;
UPDATE mv_sp_base SET v = 'TWO' WHERE id = 2;
REFRESH MATERIALIZED VIEW CONCURRENTLY mv_sp
  WHERE EXISTS (SELECT 1 FROM public.mv_sp_ids s WHERE s.id = mv_sp.id);
-- id 1 is in mv_sp_ids and id 2 is not, so only id 1 moves.
SELECT * FROM mv_sp ORDER BY id;
 id |  v  
----+-----
  1 | ONE
  2 | two
(2 rows)

-- And the other direction, so a predicate that selected everything would show.
REFRESH MATERIALIZED VIEW CONCURRENTLY mv_sp
  WHERE NOT EXISTS (SELECT 1 FROM public.mv_sp_ids s WHERE s.id = mv_sp.id);
SELECT * FROM mv_sp ORDER BY id;
 id |  v  
----+-----
  1 | ONE
  2 | TWO
(2 rows)

DROP TABLE mv_sp_ids;
DROP MATERIALIZED VIEW mv_sp;
DROP TABLE mv_sp_base;
--
-- Test 14: the row comparison and NULL
--
-- The upsert's DO UPDATE carries WHERE (mv cols) IS DISTINCT FROM (EXCLUDED
-- cols), so a row whose values did not change is not rewritten.  IS DISTINCT
-- FROM rather than <> is the whole point: `<>` yields NULL when either side is
-- NULL, the WHERE is then not true, and a row moving to or from NULL is
-- silently left at its old value.
--
-- Nothing tested that.  The comparison ran in other cases, but their data has
-- no NULLs, and the two operators agree on every non-NULL row, so replacing
-- IS DISTINCT FROM with <> passed the entire suite.
--
-- Both directions are needed and they fail differently: NULL -> value leaves the
-- old NULL, value -> NULL leaves the old value.  A test doing only one of them
-- catches only one of them.
--
CREATE TABLE mv_null_base (id int PRIMARY KEY, v int);
INSERT INTO mv_null_base VALUES (1, NULL), (2, 20), (3, NULL), (4, 40);
CREATE MATERIALIZED VIEW mv_null AS SELECT id, v FROM mv_null_base;
CREATE UNIQUE INDEX ON mv_null(id);
-- NULL -> value.  Under `<>` the comparison is NULL, the row is not updated,
-- and id 1 stays NULL.
UPDATE mv_null_base SET v = 11 WHERE id = 1;
REFRESH MATERIALIZED VIEW CONCURRENTLY mv_null WHERE id = 1;
SELECT id, v FROM mv_null ORDER BY id;
 id | v  
----+----
  1 | 11
  2 | 20
  3 |   
  4 | 40
(4 rows)

-- value -> NULL.  Same comparison, other direction: id 2 stays 20.
UPDATE mv_null_base SET v = NULL WHERE id = 2;
REFRESH MATERIALIZED VIEW CONCURRENTLY mv_null WHERE id = 2;
SELECT id, v FROM mv_null ORDER BY id;
 id | v  
----+----
  1 | 11
  2 |   
  3 |   
  4 | 40
(4 rows)

-- NULL -> NULL really is a no-op, so the row comparison is doing its job rather
-- than being bypassed: this must change nothing, and would also pass if the
-- comparison were absent.  It is here so the two cases above cannot be read as
-- "the optimization is simply off".
UPDATE mv_null_base SET v = NULL WHERE id = 3;
REFRESH MATERIALIZED VIEW CONCURRENTLY mv_null WHERE id = 3;
SELECT id, v FROM mv_null ORDER BY id;
 id | v  
----+----
  1 | 11
  2 |   
  3 |   
  4 | 40
(4 rows)

DROP MATERIALIZED VIEW mv_null;
DROP TABLE mv_null_base;
--
-- Test 15: an unchanged row is not rewritten
--
-- Test 14 reads values back, which is what a NULL bug corrupts.  It cannot see
-- the comparison being absent: without it every matched row is rewritten, which
-- is what the code did before 03cb4f0 and is still correct, so the values are
-- right either way, so nothing that reads values back can see the difference.
-- Reading the ctid is what makes the case a detector.
--
-- What the optimisation is for is not visible in the contents at all, so this
-- reads the heap instead.  An UPDATE writes a new tuple at a new location, so
-- a row that kept its ctid across the refresh is a row the refresh did not
-- write.  That is a statement about what the command did rather than about how
-- the SQL was spelled, so an implementation that skips the write some other way
-- passes it.  Taking a row lock does not move a tuple, so rows the refresh
-- locked and then left alone still read as unchanged.
--
-- Verified as a detector rather than assumed: under O1 every row comes back f.
--
-- Not rewriting a row nothing changed about is the feature's promise about
-- write amplification.  It is what makes re-refreshing an already-current
-- scope cheap, and the reason a drain can be run often.
--
CREATE TABLE mv_rowver_base (id int primary key, v int, note text);
INSERT INTO mv_rowver_base SELECT g, g * 10, 'n' || g FROM generate_series(1, 5) g;
CREATE MATERIALIZED VIEW mv_rowver AS SELECT id, v, note FROM mv_rowver_base;
CREATE UNIQUE INDEX ON mv_rowver(id);
CREATE TEMP TABLE mv_rowver_was AS SELECT id, ctid AS was FROM mv_rowver;
-- Row 3 is the only one that now differs from what the matview holds.
UPDATE mv_rowver_base SET v = 999 WHERE id = 3;
REFRESH MATERIALIZED VIEW CONCURRENTLY mv_rowver WHERE id BETWEEN 1 AND 5;
-- Only row 3 may have been written.
SELECT w.id, (w.was = m.ctid) AS same_row_version
  FROM mv_rowver_was w JOIN mv_rowver m USING (id) ORDER BY w.id;
 id | same_row_version 
----+------------------
  1 | t
  2 | t
  3 | f
  4 | t
  5 | t
(5 rows)

-- ...and it must actually have been.  Skipping too much is the other way to
-- fail this and looks identical in the column above.
SELECT id, v, note FROM mv_rowver ORDER BY id;
 id |  v  | note 
----+-----+------
  1 |  10 | n1
  2 |  20 | n2
  3 | 999 | n3
  4 |  40 | n4
  5 |  50 | n5
(5 rows)

DROP TABLE mv_rowver_was;
DROP MATERIALIZED VIEW mv_rowver;
DROP TABLE mv_rowver_base;
--
-- Test 16: the predicate's constants become parameters, and the values still
--          reach the right rows
--
-- The plan cache is keyed on the deparsed predicate, so "WHERE id = 1" and
-- "WHERE id = 2" were two different statements and a caller refreshing one row
-- at a time missed on every call.  The predicate's constants are now replaced
-- with parameters before the deparse, which makes those two the same statement
-- with different values, worth about 250 us a refresh, which is most of a
-- scope-1 refresh's cost.
--
-- That is only a win if the values go where the constants went.  Two refreshes
-- of the same shape now share one cached plan, so a bug that bound the first
-- refresh's values on the second would refresh the wrong rows and report
-- success: the plan is valid SQL and the rows it touches are perfectly good
-- rows, just not the ones asked for.  Nothing in the matview's contents says
-- which refresh wrote them.
--
-- So this drives the second refresh with the SAME constants in the OTHER order.
-- (1, 2) and (2, 1) are both real keys, both are selected by a predicate that
-- deparses identically, and each must pick up only its own row.
--
-- "A refresh acts on the rows its predicate names" is the feature's first
-- promise and does not depend on how the predicate is stored.
--
CREATE TABLE mv_pp_base (a int, b int, v text, tag text, primary key (a, b));
INSERT INTO mv_pp_base VALUES (1, 2, 'v12', 'cold'), (2, 1, 'v21', 'cold'),
                              (3, 3, 'v33', 'cold'), (4, 4, 'v44', 'hot');
CREATE MATERIALIZED VIEW mv_pp AS SELECT a, b, v, tag FROM mv_pp_base;
CREATE UNIQUE INDEX ON mv_pp (a, b);
UPDATE mv_pp_base SET v = 'V12' WHERE a = 1 AND b = 2;
REFRESH MATERIALIZED VIEW CONCURRENTLY mv_pp WHERE a = 1 AND b = 2;
-- Same predicate shape, same two constants, swapped.  Under a plan that reused
-- the first refresh's values this refreshes (1,2) again and leaves (2,1) stale.
UPDATE mv_pp_base SET v = 'V21' WHERE a = 2 AND b = 1;
REFRESH MATERIALIZED VIEW CONCURRENTLY mv_pp WHERE a = 2 AND b = 1;
-- (3,3) has never been in scope and must still hold its original value, which
-- is what says the refreshes were partial rather than accidentally total.
SELECT a, b, v FROM mv_pp ORDER BY a, b;
 a | b |  v  
---+---+-----
 1 | 2 | V12
 2 | 1 | V21
 3 | 3 | v33
 4 | 4 | v44
(4 rows)

-- A text constant, because a parameter carries its collation where a literal
-- gets one assigned at parse time, and the two must agree.  The same seam from
-- the other side is an unassigned collation, which made "tag = 'hot'" fail
-- outright.  Two refreshes again, sharing one deparsed predicate and
-- differing only in the values, so binding the wrong one refreshes the wrong
-- row.  The tag values themselves do not change, or the row would leave its
-- own predicate's scope and be pruned, which is a different behaviour and not
-- the one under test.
UPDATE mv_pp_base SET v = 'T33' WHERE a = 3;
REFRESH MATERIALIZED VIEW CONCURRENTLY mv_pp WHERE tag = 'cold' AND a = 3;
UPDATE mv_pp_base SET v = 'T44' WHERE a = 4;
REFRESH MATERIALIZED VIEW CONCURRENTLY mv_pp WHERE tag = 'hot' AND a = 4;
SELECT a, b, v, tag FROM mv_pp ORDER BY a, b;
 a | b |  v  | tag  
---+---+-----+------
 1 | 2 | V12 | cold
 2 | 1 | V21 | cold
 3 | 3 | T33 | cold
 4 | 4 | T44 | hot
(4 rows)

-- A caller-supplied parameter and a constant in one predicate: $1 keeps its
-- number and the constant is appended after it, so a refresh that renumbered
-- either would bind them to each other's positions.
DO $$
BEGIN
  UPDATE mv_pp_base SET v = 'W12' WHERE a = 1 AND b = 2;
  EXECUTE 'REFRESH MATERIALIZED VIEW CONCURRENTLY mv_pp WHERE a = $1 AND b = 2' USING 1;
END $$;
SELECT a, b, v FROM mv_pp ORDER BY a, b;
 a | b |  v  
---+---+-----
 1 | 2 | W12
 2 | 1 | V21
 3 | 3 | T33
 4 | 4 | T44
(4 rows)

DROP MATERIALIZED VIEW mv_pp;
DROP TABLE mv_pp_base;
--
-- Test 17: a row that leaves the scope is deleted, in the shapes where a
-- cheaper implementation would stop deleting it
--
-- The prune scans the scope a second time to find rows the defining query no
-- longer produces.  An implementation that wanted to skip that scan would have
-- to decide, without doing it, that nothing in scope can be orphaned, and the
-- cheap accounting for that is unsound.  It would compare how many matview rows
-- the pre-lock matched and how many rows the source produced, and skip the
-- prune when every source row is accounted for by a row already in scope or one
-- the upsert has just inserted.
--
-- That assumes a source row conflicting with an existing matview row conflicts
-- with one IN SCOPE.  A predicate reading a non-key column breaks it: ON
-- CONFLICT arbitrates on the key and knows nothing about the predicate, so the
-- upsert can match a row the pre-lock never counted, and a genuinely orphaned
-- row elsewhere in the scope cancels the discrepancy exactly.  The failure is a
-- silently missing DELETE rather than a slow refresh.
--
-- Such a guard was built, measured and removed: it was sound only while the
-- matview was held at ExclusiveLock, since the counts are taken under an
-- earlier snapshot than the DELETE they stand in for, and a partial refresh
-- takes RowExclusiveLock.  These cases are what is left of it, and they are
-- worth more than it was.
--
-- These are not tests of an optimisation.  They test the promise an
-- optimisation is allowed to keep, that a row leaving the scope is deleted, in
-- the cases where a cheaper implementation would stop keeping it.  They outlive
-- any particular guard.
--
-- 17a: the counterexample.  One row leaves the scope and one enters it, so
-- locked, source and inserted balance while a row is orphaned all the same.
CREATE TABLE mv_nd_base (k int PRIMARY KEY, status text);
INSERT INTO mv_nd_base VALUES (1, 'A'), (2, 'B');
CREATE MATERIALIZED VIEW mv_nd AS SELECT k, status FROM mv_nd_base;
CREATE UNIQUE INDEX ON mv_nd (k);
UPDATE mv_nd_base SET status = 'B' WHERE k = 1;   -- leaves the scope
UPDATE mv_nd_base SET status = 'A' WHERE k = 2;   -- enters it
-- n_locked = 1 (the matview's (1,'A')), n_source = 1 (the base's (2,'A')),
-- n_inserted = 0 (k=2 conflicts with the matview's (2,'B')).  1 + 0 = 1, and
-- k=1 must still be deleted.
REFRESH MATERIALIZED VIEW CONCURRENTLY mv_nd WHERE status = 'A';
SELECT k, status FROM mv_nd ORDER BY k;
 k | status 
---+--------
 2 | A
(1 row)

-- 17b: the same cancellation with a predicate that DOES name a key column, so
-- the gate cannot be "does the predicate mention the key".
CREATE TABLE mv_nd5_base (k int PRIMARY KEY, status text, v text);
INSERT INTO mv_nd5_base VALUES (1, 'A', 'p'), (2, 'B', 'q');
CREATE MATERIALIZED VIEW mv_nd5 AS SELECT k, status, v FROM mv_nd5_base;
CREATE UNIQUE INDEX ON mv_nd5 (k);
UPDATE mv_nd5_base SET status = 'B' WHERE k = 1;
UPDATE mv_nd5_base SET status = 'A' WHERE k = 2;
REFRESH MATERIALIZED VIEW CONCURRENTLY mv_nd5 WHERE k <= 2 AND status = 'A';
SELECT k, status, v FROM mv_nd5 ORDER BY k;
 k | status | v 
---+--------+---
 2 | A      | q
(1 row)

-- 17c: a key-only predicate, both directions.  The first refresh is the case
-- the elision exists for, where every source row matches a row already in
-- scope, and the second is the same statement when a row really has gone.
CREATE TABLE mv_nd2_base (k int PRIMARY KEY, v text);
INSERT INTO mv_nd2_base VALUES (1, 'a'), (2, 'b'), (3, 'c');
CREATE MATERIALIZED VIEW mv_nd2 AS SELECT k, v FROM mv_nd2_base;
CREATE UNIQUE INDEX ON mv_nd2 (k);
UPDATE mv_nd2_base SET v = 'A' WHERE k = 1;
REFRESH MATERIALIZED VIEW CONCURRENTLY mv_nd2 WHERE k <= 2;
SELECT k, v FROM mv_nd2 ORDER BY k;
 k | v 
---+---
 1 | A
 2 | b
 3 | c
(3 rows)

DELETE FROM mv_nd2_base WHERE k = 2;
REFRESH MATERIALIZED VIEW CONCURRENTLY mv_nd2 WHERE k <= 2;
SELECT k, v FROM mv_nd2 ORDER BY k;
 k | v 
---+---
 1 | A
 3 | c
(2 rows)

-- 17d: nothing in scope at all.  The matview holds no row the predicate
-- selects, so the DELETE cannot match, since the upsert's own insert is not
-- visible to it, and the row still has to arrive.
INSERT INTO mv_nd2_base VALUES (2, 'B');
REFRESH MATERIALIZED VIEW CONCURRENTLY mv_nd2 WHERE k = 2;
SELECT k, v FROM mv_nd2 ORDER BY k;
 k | v 
---+---
 1 | A
 2 | B
 3 | c
(3 rows)

-- 17e: a composite key with the predicate covering only its leading column.
-- Still key-only, and the counts still have to notice the row that went.
CREATE TABLE mv_nd4_base (a int, b int, v text, PRIMARY KEY (a, b));
INSERT INTO mv_nd4_base VALUES (1, 1, 'x'), (1, 2, 'y'), (2, 1, 'z');
CREATE MATERIALIZED VIEW mv_nd4 AS SELECT a, b, v FROM mv_nd4_base;
CREATE UNIQUE INDEX ON mv_nd4 (a, b);
DELETE FROM mv_nd4_base WHERE a = 1 AND b = 2;
UPDATE mv_nd4_base SET v = 'X' WHERE a = 1 AND b = 1;
REFRESH MATERIALIZED VIEW CONCURRENTLY mv_nd4 WHERE a = 1;
SELECT a, b, v FROM mv_nd4 ORDER BY a, b;
 a | b | v 
---+---+---
 1 | 1 | X
 2 | 1 | z
(2 rows)

-- 17f: every column is a key column, so the upsert is ON CONFLICT DO NOTHING
-- and a conflicting row returns nothing at all.  The count still has to come
-- out right, because what it counts is the inserts and an insert is returned on
-- either branch.  This is also the only case that exercises the RETURNING
-- clause on the DO NOTHING arm.
CREATE TABLE mv_nd6_base (a int, b int, PRIMARY KEY (a, b));
INSERT INTO mv_nd6_base VALUES (1, 1), (1, 2), (2, 1);
CREATE MATERIALIZED VIEW mv_nd6 AS SELECT a, b FROM mv_nd6_base;
CREATE UNIQUE INDEX ON mv_nd6 (a, b);
-- one row leaves and one arrives, so n_locked 2 + n_inserted 1 <> n_source 2
DELETE FROM mv_nd6_base WHERE a = 1 AND b = 2;
INSERT INTO mv_nd6_base VALUES (1, 3);
REFRESH MATERIALIZED VIEW CONCURRENTLY mv_nd6 WHERE a = 1;
SELECT a, b FROM mv_nd6 ORDER BY a, b;
 a | b 
---+---
 1 | 1
 1 | 3
 2 | 1
(3 rows)

DROP MATERIALIZED VIEW mv_nd6;
DROP TABLE mv_nd6_base;
DROP MATERIALIZED VIEW mv_nd4;
DROP TABLE mv_nd4_base;
DROP MATERIALIZED VIEW mv_nd2;
DROP TABLE mv_nd2_base;
DROP MATERIALIZED VIEW mv_nd5;
DROP TABLE mv_nd5_base;
DROP MATERIALIZED VIEW mv_nd;
DROP TABLE mv_nd_base;
--
-- Test 18: a subquery in the predicate
--
-- Naming the right scope often needs one.  A change to a dimension table
-- changes the output rows of every fact row joined to it, and the predicate has
-- to select those rows, which means asking the fact table which they are, not
-- naming the dimension's own key.  That is the shape the documentation's
-- blast-radius warning tells people to write, so it has to work.
--
-- The correlated case is the one worth pinning.  An uncorrelated subquery is
-- resolved without ever referring back to the matview, so nothing about how the
-- matview is named can go wrong; the moment a subquery refers back, the
-- predicate has to be deparsed into the generated statements under the name
-- those statements actually use.  Test 13 covers the deparse itself; these
-- cover the shapes it has to survive, and that the result converges with a full
-- refresh.
--
-- Correlated predicates reach parts of the generated SQL that no other case
-- does, and the failure is loud rather than silent.
--
CREATE TABLE mv_sq_fact (id int PRIMARY KEY, did int, v int);
CREATE TABLE mv_sq_dim (id int PRIMARY KEY, nm text);
INSERT INTO mv_sq_dim VALUES (1, 'one'), (2, 'two'), (3, 'three');
INSERT INTO mv_sq_fact SELECT g, (g % 3) + 1, g * 10 FROM generate_series(1, 9) g;
CREATE MATERIALIZED VIEW mv_sq AS
  SELECT f.id, f.did, d.nm, f.v
    FROM mv_sq_fact f JOIN mv_sq_dim d ON d.id = f.did;
CREATE UNIQUE INDEX ON mv_sq(id);
-- The dimension row changes, so every fact row joined to it is stale.  The
-- correct scope is "the fact rows whose did is 1", which only the fact table
-- knows.
UPDATE mv_sq_dim SET nm = 'ONE' WHERE id = 1;
REFRESH MATERIALIZED VIEW CONCURRENTLY mv_sq
  WHERE EXISTS (SELECT 1 FROM public.mv_sq_fact f
                 WHERE f.id = mv_sq.id AND f.did = 1);
SELECT id, did, nm FROM mv_sq ORDER BY id;
 id | did |  nm   
----+-----+-------
  1 |   2 | two
  2 |   3 | three
  3 |   1 | ONE
  4 |   2 | two
  5 |   3 | three
  6 |   1 | ONE
  7 |   2 | two
  8 |   3 | three
  9 |   1 | ONE
(9 rows)

-- IN, correlated on a different column from the one it selects.
UPDATE mv_sq_dim SET nm = 'TWO' WHERE id = 2;
REFRESH MATERIALIZED VIEW CONCURRENTLY mv_sq
  WHERE id IN (SELECT f.id FROM public.mv_sq_fact f
                WHERE f.did = mv_sq.did AND f.did = 2);
SELECT id, did, nm FROM mv_sq ORDER BY id;
 id | did |  nm   
----+-----+-------
  1 |   2 | TWO
  2 |   3 | three
  3 |   1 | ONE
  4 |   2 | TWO
  5 |   3 | three
  6 |   1 | ONE
  7 |   2 | TWO
  8 |   3 | three
  9 |   1 | ONE
(9 rows)

-- Nested, so the correlation crosses two levels.
UPDATE mv_sq_dim SET nm = 'THREE' WHERE id = 3;
REFRESH MATERIALIZED VIEW CONCURRENTLY mv_sq
  WHERE EXISTS (SELECT 1 FROM public.mv_sq_fact o
                 WHERE o.id = mv_sq.id
                   AND EXISTS (SELECT 1 FROM public.mv_sq_dim i
                                WHERE i.id = o.did AND i.id = 3));
SELECT id, did, nm FROM mv_sq ORDER BY id;
 id | did |  nm   
----+-----+-------
  1 |   2 | TWO
  2 |   3 | THREE
  3 |   1 | ONE
  4 |   2 | TWO
  5 |   3 | THREE
  6 |   1 | ONE
  7 |   2 | TWO
  8 |   3 | THREE
  9 |   1 | ONE
(9 rows)

-- Correlated, with the constant arriving as a bound parameter.  The predicate's
-- own constants become parameters before the deparse, so a correlated
-- subquery has to survive that too.
UPDATE mv_sq_dim SET nm = 'uno' WHERE id = 1;
DO $$
BEGIN
  EXECUTE 'REFRESH MATERIALIZED VIEW CONCURRENTLY mv_sq
             WHERE EXISTS (SELECT 1 FROM public.mv_sq_fact f
                            WHERE f.id = mv_sq.id AND f.did = $1)' USING 1;
END $$;
SELECT id, did, nm FROM mv_sq ORDER BY id;
 id | did |  nm   
----+-----+-------
  1 |   2 | TWO
  2 |   3 | THREE
  3 |   1 | uno
  4 |   2 | TWO
  5 |   3 | THREE
  6 |   1 | uno
  7 |   2 | TWO
  8 |   3 | THREE
  9 |   1 | uno
(9 rows)

-- Twice with the same predicate, so the second refresh runs off the cached
-- plan, and with the subquery's own table changed in between, which the
-- cached statement has to notice.  Row 2 moves into did 1 and must be picked up
-- by a predicate that names did 1 but never mentions row 2.
UPDATE mv_sq_dim SET nm = 'A1' WHERE id = 1;
REFRESH MATERIALIZED VIEW CONCURRENTLY mv_sq
  WHERE EXISTS (SELECT 1 FROM public.mv_sq_fact f
                 WHERE f.id = mv_sq.id AND f.did = 1);
UPDATE mv_sq_fact SET did = 1 WHERE id = 2;
UPDATE mv_sq_dim SET nm = 'A2' WHERE id = 1;
REFRESH MATERIALIZED VIEW CONCURRENTLY mv_sq
  WHERE EXISTS (SELECT 1 FROM public.mv_sq_fact f
                 WHERE f.id = mv_sq.id AND f.did = 1);
SELECT id, did, nm FROM mv_sq ORDER BY id;
 id | did |  nm   
----+-----+-------
  1 |   2 | TWO
  2 |   1 | A2
  3 |   1 | A2
  4 |   2 | TWO
  5 |   3 | THREE
  6 |   1 | A2
  7 |   2 | TWO
  8 |   3 | THREE
  9 |   1 | A2
(9 rows)

-- ... and all of that converged with what a full refresh produces.  This is the
-- check that makes the ones above mean something: they assert particular rows,
-- this asserts there is nothing else wrong.
CREATE TEMP TABLE mv_sq_partial AS SELECT * FROM mv_sq;
REFRESH MATERIALIZED VIEW mv_sq;
SELECT count(*) AS full_has_rows_partial_does_not
  FROM (SELECT * FROM mv_sq EXCEPT ALL SELECT * FROM mv_sq_partial) d;
 full_has_rows_partial_does_not 
--------------------------------
                              0
(1 row)

SELECT count(*) AS partial_has_rows_full_does_not
  FROM (SELECT * FROM mv_sq_partial EXCEPT ALL SELECT * FROM mv_sq) d;
 partial_has_rows_full_does_not 
--------------------------------
                              0
(1 row)

DROP TABLE mv_sq_partial;
DROP MATERIALIZED VIEW mv_sq;
DROP TABLE mv_sq_fact;
DROP TABLE mv_sq_dim;
--
-- Test 19: the shapes a subquery predicate can take
--
-- Test 18 covers a few forms in detail.  This covers the space: every way a
-- subquery can be attached to the predicate, and every name in the generated
-- SQL that a subquery could collide with.
--
-- The property checked is the same for all of them and does not depend on the
-- form.  The predicate names a set of rows; evaluate it directly to learn
-- which.  Then make EVERY row stale, refresh partially, and require that the
-- rows in that set match a full refresh while the rows outside it did not move
-- at all, with the same value and the same ctid.  A predicate that silently widened would
-- still converge with a full refresh, so convergence alone cannot see it; the
-- ctid is what says the refresh stayed inside its scope.
--
-- What this is a detector for, measured rather than assumed: with the
-- predicate deparsed against the matview's name instead of the alias the
-- generated statements use, 18 of the 29 fail with "missing FROM-clause
-- entry".  The 11 that survive are exactly the uncorrelated ones, because
-- ruleutils only qualifies a Var once something else is in scope.  So
-- correlation is the axis that matters here, and the uncorrelated rows are
-- carried for the correctness half rather than the aliasing half.
--
-- What it is NOT a detector for, also measured: mutation C7, which drops the
-- predicate from the plan cache key, leaves all 29 green.  Each probe does a
-- full refresh first, and that invalidates the cache, so no probe ever reuses
-- another's plans.  matview_where_cache Tests 6 and 7 are where that lives.
--
-- The aliasing rows are the only place anything checks that the generated
-- SQL's own names survive a predicate that uses them.
--
CREATE TABLE sq_fact (id int PRIMARY KEY, gid int, tag text);
CREATE TABLE sq_dim  (gid int PRIMARY KEY, nm text);
INSERT INTO sq_dim  SELECT g, 'n' || g FROM generate_series(1, 4) g;
INSERT INTO sq_fact SELECT g, (g % 4) + 1, 't' || (g % 3) FROM generate_series(1, 12) g;
-- Relations named after every alias and CTE the generated statements invent.
CREATE TABLE mv       (id int);  INSERT INTO mv       VALUES (-1);
CREATE TABLE nd       (id int);  INSERT INTO nd       VALUES (-2);
CREATE TABLE new_data (id int);  INSERT INTO new_data VALUES (-3);
CREATE TABLE upsert   (id int);  INSERT INTO upsert   VALUES (-4);
CREATE TABLE pruned   (id int);  INSERT INTO pruned   VALUES (-5);
CREATE MATERIALIZED VIEW sq_mv AS
  SELECT f.id, f.gid, f.tag, d.nm
    FROM public.sq_fact f JOIN public.sq_dim d ON d.gid = f.gid;
CREATE UNIQUE INDEX ON sq_mv(id);
CREATE MATERIALIZED VIEW sq_full AS
  SELECT f.id, f.gid, f.tag, d.nm
    FROM public.sq_fact f JOIN public.sq_dim d ON d.gid = f.gid;
CREATE UNIQUE INDEX ON sq_full(id);
CREATE FUNCTION sq_probe(label text, pred text) RETURNS text LANGUAGE plpgsql AS $$
DECLARE
  scope int[]; wrong int; touched int;
BEGIN
  -- Reset both matviews to the same fully refreshed state.
  UPDATE public.sq_dim SET nm = 'n' || gid;
  REFRESH MATERIALIZED VIEW public.sq_mv;
  REFRESH MATERIALIZED VIEW public.sq_full;

  -- The rows the predicate names, evaluated directly.  This is the ground
  -- truth the refresh is measured against, and it is deliberately not derived
  -- from anything the refresh does.
  EXECUTE 'SELECT array_agg(id ORDER BY id) FROM public.sq_mv WHERE ' || pred
    INTO scope;
  scope := coalesce(scope, '{}');

  CREATE TEMP TABLE sq_before ON COMMIT DROP AS
    SELECT id, ctid AS ct, nm FROM public.sq_mv;

  -- Every row is now stale, so an untouched row is visible as such.
  UPDATE public.sq_dim SET nm = nm || '*';
  REFRESH MATERIALIZED VIEW public.sq_full;

  EXECUTE 'REFRESH MATERIALIZED VIEW CONCURRENTLY public.sq_mv WHERE ' || pred;

  SELECT count(*) INTO wrong
    FROM public.sq_mv m JOIN public.sq_full f USING (id)
   WHERE m.id = ANY(scope)
     AND (m.nm, m.gid, m.tag) IS DISTINCT FROM (f.nm, f.gid, f.tag);

  SELECT count(*) INTO touched
    FROM public.sq_mv m JOIN sq_before b USING (id)
   WHERE NOT (m.id = ANY(scope))
     AND (m.nm IS DISTINCT FROM b.nm OR m.ctid <> b.ct);

  DROP TABLE sq_before;
  RETURN format('%-24s scope=%-2s %s', label, coalesce(array_length(scope,1),0),
                CASE WHEN wrong = 0 AND touched = 0 THEN 'ok'
                     ELSE format('in_scope_wrong=%s out_of_scope_touched=%s',
                                 wrong, touched) END);
END $$;
SELECT sq_probe('correlated EXISTS',    $$EXISTS (SELECT 1 FROM public.sq_fact f WHERE f.id = sq_mv.id AND f.gid = 1)$$);
               sq_probe               
--------------------------------------
 correlated EXISTS        scope=3  ok
(1 row)

SELECT sq_probe('correlated NOT EXISTS',$$NOT EXISTS (SELECT 1 FROM public.sq_fact f WHERE f.id = sq_mv.id AND f.gid = 1)$$);
               sq_probe               
--------------------------------------
 correlated NOT EXISTS    scope=9  ok
(1 row)

SELECT sq_probe('uncorrelated IN',      $$id IN (SELECT f.id FROM public.sq_fact f WHERE f.gid = 2)$$);
               sq_probe               
--------------------------------------
 uncorrelated IN          scope=3  ok
(1 row)

SELECT sq_probe('correlated IN',        $$id IN (SELECT f.id FROM public.sq_fact f WHERE f.gid = sq_mv.gid AND f.gid = 2)$$);
               sq_probe               
--------------------------------------
 correlated IN            scope=3  ok
(1 row)

SELECT sq_probe('NOT IN',               $$id NOT IN (SELECT f.id FROM public.sq_fact f WHERE f.gid = 1)$$);
               sq_probe               
--------------------------------------
 NOT IN                   scope=9  ok
(1 row)

SELECT sq_probe('= ANY (subquery)',     $$id = ANY (SELECT f.id FROM public.sq_fact f WHERE f.gid = sq_mv.gid AND f.gid = 3)$$);
               sq_probe               
--------------------------------------
 = ANY (subquery)         scope=3  ok
(1 row)

SELECT sq_probe('<> ALL (subquery)',    $$id <> ALL (SELECT f.id FROM public.sq_fact f WHERE f.gid = 1)$$);
               sq_probe               
--------------------------------------
 <> ALL (subquery)        scope=9  ok
(1 row)

SELECT sq_probe('correlated scalar',    $$id = (SELECT max(f.id) FROM public.sq_fact f WHERE f.gid = sq_mv.gid)$$);
               sq_probe               
--------------------------------------
 correlated scalar        scope=4  ok
(1 row)

SELECT sq_probe('ARRAY(subquery)',      $$id = ANY (ARRAY(SELECT f.id FROM public.sq_fact f WHERE f.gid = sq_mv.gid AND f.gid = 2))$$);
               sq_probe               
--------------------------------------
 ARRAY(subquery)          scope=3  ok
(1 row)

SELECT sq_probe('row-constructor IN',   $$(id, gid) IN (SELECT f.id, f.gid FROM public.sq_fact f WHERE f.gid = 2)$$);
               sq_probe               
--------------------------------------
 row-constructor IN       scope=3  ok
(1 row)

SELECT sq_probe('GROUP BY + HAVING',    $$gid IN (SELECT f.gid FROM public.sq_fact f GROUP BY f.gid HAVING count(*) > 2)$$);
               sq_probe               
--------------------------------------
 GROUP BY + HAVING        scope=12 ok
(1 row)

SELECT sq_probe('UNION inside',         $$id IN (SELECT f.id FROM public.sq_fact f WHERE f.gid = 1 UNION SELECT f.id FROM public.sq_fact f WHERE f.gid = 2)$$);
               sq_probe               
--------------------------------------
 UNION inside             scope=6  ok
(1 row)

SELECT sq_probe('nested 2 levels',      $$EXISTS (SELECT 1 FROM public.sq_fact o WHERE o.id = sq_mv.id AND EXISTS (SELECT 1 FROM public.sq_dim i WHERE i.gid = o.gid AND i.gid = 2))$$);
               sq_probe               
--------------------------------------
 nested 2 levels          scope=3  ok
(1 row)

SELECT sq_probe('LATERAL inside',       $$EXISTS (SELECT 1 FROM public.sq_fact f, LATERAL (SELECT d.gid FROM public.sq_dim d WHERE d.gid = f.gid) l WHERE f.id = sq_mv.id AND l.gid = 2)$$);
               sq_probe               
--------------------------------------
 LATERAL inside           scope=3  ok
(1 row)

SELECT sq_probe('CTE inside',           $$id IN (WITH w AS (SELECT f.id, f.gid FROM public.sq_fact f) SELECT w.id FROM w WHERE w.gid = sq_mv.gid AND w.gid = 3)$$);
               sq_probe               
--------------------------------------
 CTE inside               scope=3  ok
(1 row)

SELECT sq_probe('self-reference',       $$id IN (SELECT s.id FROM public.sq_mv s WHERE s.gid = 2)$$);
               sq_probe               
--------------------------------------
 self-reference           scope=3  ok
(1 row)

SELECT sq_probe('ORDER BY + LIMIT',     $$id IN (SELECT f.id FROM public.sq_fact f WHERE f.gid = 2 ORDER BY f.id LIMIT 2)$$);
               sq_probe               
--------------------------------------
 ORDER BY + LIMIT         scope=2  ok
(1 row)

SELECT sq_probe('window inside',        $$id IN (SELECT x.id FROM (SELECT f.id, row_number() OVER (ORDER BY f.id) rn FROM public.sq_fact f) x WHERE x.rn <= 3)$$);
               sq_probe               
--------------------------------------
 window inside            scope=3  ok
(1 row)

SELECT sq_probe('two subqueries AND/OR',$$EXISTS (SELECT 1 FROM public.sq_fact f WHERE f.id = sq_mv.id AND f.gid = 1) OR id IN (SELECT f.id FROM public.sq_fact f WHERE f.gid = 3)$$);
               sq_probe               
--------------------------------------
 two subqueries AND/OR    scope=6  ok
(1 row)

-- The generated statements alias the matview, name two CTEs and an ephemeral
-- relation, and join against an alias.  A predicate is free to use any of those
-- names for something else.
SELECT sq_probe('alias named mv',       $$EXISTS (SELECT 1 FROM public.sq_fact mv WHERE mv.id = sq_mv.id AND mv.gid = 2)$$);
               sq_probe               
--------------------------------------
 alias named mv           scope=3  ok
(1 row)

SELECT sq_probe('alias named nd',       $$EXISTS (SELECT 1 FROM public.sq_fact nd WHERE nd.id = sq_mv.id AND nd.gid = 2)$$);
               sq_probe               
--------------------------------------
 alias named nd           scope=3  ok
(1 row)

SELECT sq_probe('alias named new_data', $$EXISTS (SELECT 1 FROM public.sq_fact new_data WHERE new_data.id = sq_mv.id AND new_data.gid = 2)$$);
               sq_probe               
--------------------------------------
 alias named new_data     scope=3  ok
(1 row)

SELECT sq_probe('alias named upsert',   $$EXISTS (SELECT 1 FROM public.sq_fact upsert WHERE upsert.id = sq_mv.id AND upsert.gid = 2)$$);
               sq_probe               
--------------------------------------
 alias named upsert       scope=3  ok
(1 row)

SELECT sq_probe('alias named pruned',   $$EXISTS (SELECT 1 FROM public.sq_fact pruned WHERE pruned.id = sq_mv.id AND pruned.gid = 2)$$);
               sq_probe               
--------------------------------------
 alias named pruned       scope=3  ok
(1 row)

SELECT sq_probe('alias = matview name', $$EXISTS (SELECT 1 FROM public.sq_fact sq_mv WHERE sq_mv.id = public.sq_mv.id AND sq_mv.gid = 2)$$);
               sq_probe               
--------------------------------------
 alias = matview name     scope=3  ok
(1 row)

SELECT sq_probe('real table named mv',  $$id IN (SELECT m.id FROM public.mv m) OR id IN (SELECT f.id FROM public.sq_fact f WHERE f.gid = 2)$$);
               sq_probe               
--------------------------------------
 real table named mv      scope=3  ok
(1 row)

SELECT sq_probe('real table new_data',  $$id IN (SELECT n.id FROM public.new_data n) OR id IN (SELECT f.id FROM public.sq_fact f WHERE f.gid = 3)$$);
               sq_probe               
--------------------------------------
 real table new_data      scope=3  ok
(1 row)

SELECT sq_probe('unqualified inner col',$$EXISTS (SELECT 1 FROM public.sq_fact f WHERE f.id = sq_mv.id AND gid = 2)$$);
               sq_probe               
--------------------------------------
 unqualified inner col    scope=3  ok
(1 row)

SELECT sq_probe('shadowed 2 levels',    $$EXISTS (SELECT 1 FROM public.sq_fact mv WHERE mv.id = sq_mv.id AND EXISTS (SELECT 1 FROM public.sq_dim mv2 WHERE mv2.gid = mv.gid AND mv2.gid = 2))$$);
               sq_probe               
--------------------------------------
 shadowed 2 levels        scope=3  ok
(1 row)

-- None of the shadowed tables was read or written.
SELECT (SELECT count(*) FROM mv) + (SELECT count(*) FROM nd)
     + (SELECT count(*) FROM new_data) + (SELECT count(*) FROM upsert)
     + (SELECT count(*) FROM pruned) AS shadowed_rows_intact;
 shadowed_rows_intact 
----------------------
                    5
(1 row)

DROP FUNCTION sq_probe(text, text);
DROP MATERIALIZED VIEW sq_full;
DROP MATERIALIZED VIEW sq_mv;
DROP TABLE mv, nd, new_data, upsert, pruned;
DROP TABLE sq_fact;
DROP TABLE sq_dim;
--
-- Test 20: the source must be applicable one row at a time
--
-- Found by running the cases from the thread "Two issues with REFRESH
-- MATERIALIZED VIEW CONCURRENTLY", which is about the duplicate
-- precheck in refresh_by_match_merge().  A partial refresh never reaches that
-- precheck, and it needs one for its own reason: the upsert applies the source
-- rows one at a time against the arbiter index, so two source rows sharing a
-- key cannot both be represented.  Without a check the second overwrote the
-- first and the matview quietly ended up with fewer rows than the query
-- produces, including for duplicates with no NULLs anywhere, which a full
-- refresh has caught all along.
--
-- Which rows conflict is the index's question rather than GROUP BY's, and the
-- last three cases are why that distinction is in the code: a NULL key does
-- not conflict with another NULL key, unless the index says NULLS NOT
-- DISTINCT.
--
-- The refusal names the duplicated key only for a caller who owns the matview.
-- A full refresh's version of this error prints the offending row
-- unconditionally, on the stated grounds that only the owner can run REFRESH,
-- which stopped being true when MAINTAIN was added.  matview_where_privs
-- Test 7 covers both sides of that.
--
CREATE TABLE dup_base (a text, b text);
INSERT INTO dup_base VALUES ('k', 'v');
CREATE MATERIALIZED VIEW dup_mv AS SELECT a, b FROM dup_base;
CREATE UNIQUE INDEX ON dup_mv (a);
-- 20a: identical rows, with a NULL.  The full refresh misses this one; the
-- partial refresh must not.
INSERT INTO dup_base VALUES ('k', 'v');
REFRESH MATERIALIZED VIEW CONCURRENTLY dup_mv WHERE a = 'k';
ERROR:  new data for materialized view "dup_mv" contains duplicate rows
DETAIL:  Key: (k)
HINT:  A partial refresh applies its changes one row at a time, so the new data must not contain two rows with the same key.
SELECT count(*) AS a_rows_unchanged FROM dup_mv;
 a_rows_unchanged 
------------------
                1
(1 row)

-- 20b: same key, differing elsewhere.  Nothing here is a duplicate row, but
-- the arbiter index still cannot hold both.
UPDATE dup_base SET b = 'w' WHERE ctid = (SELECT max(ctid) FROM dup_base);
REFRESH MATERIALIZED VIEW CONCURRENTLY dup_mv WHERE a = 'k';
ERROR:  new data for materialized view "dup_mv" contains duplicate rows
DETAIL:  Key: (k)
HINT:  A partial refresh applies its changes one row at a time, so the new data must not contain two rows with the same key.
SELECT count(*) AS b_rows_unchanged FROM dup_mv;
 b_rows_unchanged 
------------------
                1
(1 row)

-- 20c: no NULL anywhere, which a full refresh has always rejected
DELETE FROM dup_base;
INSERT INTO dup_base VALUES ('k', 'v'), ('k', 'v');
REFRESH MATERIALIZED VIEW CONCURRENTLY dup_mv WHERE a = 'k';
ERROR:  new data for materialized view "dup_mv" contains duplicate rows
DETAIL:  Key: (k)
HINT:  A partial refresh applies its changes one row at a time, so the new data must not contain two rows with the same key.
-- 20d: and the refresh is fine once the source is unambiguous again
DELETE FROM dup_base;
INSERT INTO dup_base VALUES ('k', 'v2');
REFRESH MATERIALIZED VIEW CONCURRENTLY dup_mv WHERE a = 'k';
SELECT a, b FROM dup_mv ORDER BY a;
 a | b  
---+----
 k | v2
(1 row)

DROP MATERIALIZED VIEW dup_mv;
-- 20e: a NULL key does not conflict with another NULL key, so two of them are
-- not duplicates and the refresh proceeds.
DELETE FROM dup_base;
INSERT INTO dup_base VALUES (NULL, 'x');
CREATE MATERIALIZED VIEW dup_mv AS SELECT a, b FROM dup_base;
CREATE UNIQUE INDEX ON dup_mv (a);
INSERT INTO dup_base VALUES (NULL, 'y');
REFRESH MATERIALIZED VIEW CONCURRENTLY dup_mv WHERE a IS NULL;
SELECT count(*) AS e_rows FROM dup_mv;
 e_rows 
--------
      2
(1 row)

DROP MATERIALIZED VIEW dup_mv;
-- 20f: NULLS NOT DISTINCT reverses that, and the check has to follow the index
DELETE FROM dup_base;
INSERT INTO dup_base VALUES (NULL, 'x');
CREATE MATERIALIZED VIEW dup_mv AS SELECT a, b FROM dup_base;
CREATE UNIQUE INDEX ON dup_mv (a) NULLS NOT DISTINCT;
INSERT INTO dup_base VALUES (NULL, 'y');
REFRESH MATERIALIZED VIEW CONCURRENTLY dup_mv WHERE a IS NULL;
ERROR:  new data for materialized view "dup_mv" contains duplicate rows
DETAIL:  Key: ()
HINT:  A partial refresh applies its changes one row at a time, so the new data must not contain two rows with the same key.
SELECT count(*) AS f_rows_unchanged FROM dup_mv;
 f_rows_unchanged 
------------------
                1
(1 row)

DROP MATERIALIZED VIEW dup_mv;
DROP TABLE dup_base;
