--
-- REFRESH MATERIALIZED VIEW ... WHERE ... : session plan cache
--
-- refresh_by_direct_modification() caches the two SPI plans it builds (the
-- row-locking SELECT and the fused upsert/delete CTE) in a session-level hash
-- table keyed on the matview OID.  An entry is reused when the arbiter index
-- OID and the deparsed WHERE clause text both match.
--
-- These tests all depend on cache state accumulated over the session, so they
-- live in their own file to keep that state predictable, and they must run in
-- the order written.
--
-- Every case here covers a known defect.  The expected output describes what
-- the command should do, so they fail until the defect is fixed; each one is
-- annotated with an XXX comment naming the behaviour seen today.
--
--
-- Test 1: Renaming the materialized view
--
-- SPI_keepplan() saves the plan together with its raw parse tree.  When the
-- plan is invalidated it is re-analyzed from that raw tree, which resolves the
-- relation by name.  Renaming the matview does not change its OID, so the
-- cache entry is still considered valid, but the SQL inside it is not.
--
CREATE TABLE mv_c_base (id int primary key, v text);
INSERT INTO mv_c_base VALUES (1, 'one'), (2, 'two');
CREATE MATERIALIZED VIEW mv_c AS SELECT id, v FROM mv_c_base;
CREATE UNIQUE INDEX ON mv_c(id);
-- Warm the cache for this matview and this predicate.
REFRESH MATERIALIZED VIEW mv_c WHERE id = 1;
ALTER MATERIALIZED VIEW mv_c RENAME TO mv_c_renamed;
UPDATE mv_c_base SET v = 'one-updated' WHERE id = 1;
-- Must succeed and pick up the new value.
-- XXX currently errors: the cached plan still names the pre-rename relation.
-- The VERBOSITY guard keeps that failure to one line instead of also emitting
-- the generated statement.
\set VERBOSITY terse
REFRESH MATERIALIZED VIEW mv_c_renamed WHERE id = 1;
\set VERBOSITY default
SELECT * FROM mv_c_renamed ORDER BY id;
 id |      v      
----+-------------
  1 | one-updated
  2 | two
(2 rows)

--
-- Test 2: Another relation taking over the old name
--
-- Worse than an error: once something else occupies the name the cached plan
-- referred to, re-analysis silently resolves to that other relation.
--
CREATE TABLE mv_c_decoy_base (id int primary key, v text);
INSERT INTO mv_c_decoy_base VALUES (1, 'decoy-one'), (2, 'decoy-two');
-- This matview now owns the name "mv_c" that the cached plan refers to.
CREATE MATERIALIZED VIEW mv_c AS SELECT id, v FROM mv_c_decoy_base;
CREATE UNIQUE INDEX ON mv_c(id);
-- Refresh the *original* matview, by its current name.
REFRESH MATERIALIZED VIEW mv_c_renamed WHERE id = 1;
-- XXX the refresh above reports success but does nothing here.
SELECT * FROM mv_c_renamed ORDER BY id;
 id |      v      
----+-------------
  1 | one-updated
  2 | two
(2 rows)

-- XXX ... and writes to this unrelated matview instead, with data drawn from
-- the other matview's base table.  No lock and no MAINTAIN privilege check was
-- ever taken on mv_c.
SELECT * FROM mv_c ORDER BY id;
 id |     v     
----+-----------
  1 | decoy-one
  2 | decoy-two
(2 rows)

DROP MATERIALIZED VIEW mv_c;
DROP TABLE mv_c_decoy_base;
DROP MATERIALIZED VIEW mv_c_renamed;
DROP TABLE mv_c_base;
--
-- Test 3: Renaming a base table
--
-- The cached refresh plan embeds pg_get_viewdef() output, so the same
-- re-analysis hazard applies to every relation the view definition names.
--
CREATE TABLE mv_c2_base (id int primary key, v text);
INSERT INTO mv_c2_base VALUES (1, 'real');
CREATE MATERIALIZED VIEW mv_c2 AS SELECT id, v FROM mv_c2_base;
CREATE UNIQUE INDEX ON mv_c2(id);
-- Warm the cache.
REFRESH MATERIALIZED VIEW mv_c2 WHERE id = 1;
ALTER TABLE mv_c2_base RENAME TO mv_c2_base_old;
CREATE TABLE mv_c2_base (id int primary key, v text);
INSERT INTO mv_c2_base VALUES (1, 'decoy');
-- mv_c2 is still defined over mv_c2_base_old.
SELECT pg_get_viewdef('mv_c2'::pg_catalog.regclass);
     pg_get_viewdef      
-------------------------
  SELECT id,            +
     v                  +
    FROM mv_c2_base_old;
(1 row)

REFRESH MATERIALIZED VIEW mv_c2 WHERE id = 1;
-- XXX currently filled from the decoy table rather than from the table the
-- view definition actually names.
SELECT * FROM mv_c2 ORDER BY id;
 id |  v   
----+------
  1 | real
(1 row)

DROP MATERIALIZED VIEW mv_c2;
DROP TABLE mv_c2_base;
DROP TABLE mv_c2_base_old;
--
-- Test 4: Parameter types are not part of the cache key
--
-- pg_get_expr() renders an external parameter as "$1" with no type
-- information, so predicates that differ only in parameter type deparse
-- identically and share a cache entry.  The saved plan keeps the argument
-- types it was first prepared with.
--
CREATE TABLE mv_c3_base (id bigint primary key, v text);
INSERT INTO mv_c3_base VALUES (1, 'orig-small'), (4294967297, 'orig-large');
CREATE MATERIALIZED VIEW mv_c3 AS SELECT id, v FROM mv_c3_base;
CREATE UNIQUE INDEX ON mv_c3(id);
SELECT * FROM mv_c3 ORDER BY id;
     id     |     v      
------------+------------
          1 | orig-small
 4294967297 | orig-large
(2 rows)

-- Warm the cache with an int4 parameter.
DO $$ BEGIN
  EXECUTE 'REFRESH MATERIALIZED VIEW mv_c3 WHERE id = $1' USING 1::int;
END $$;
UPDATE mv_c3_base SET v = 'new-small' WHERE id = 1;
UPDATE mv_c3_base SET v = 'new-large' WHERE id = 4294967297;
-- Same deparsed predicate, but an int8 parameter.  4294967297 has 1 in its low
-- 32 bits, so a plan expecting int4 reads the argument as 1.
DO $$ BEGIN
  EXECUTE 'REFRESH MATERIALIZED VIEW mv_c3 WHERE id = $1' USING 4294967297::bigint;
END $$;
-- XXX currently refreshes id = 1 instead of id = 4294967297.
SELECT * FROM mv_c3 ORDER BY id;
     id     |     v      
------------+------------
          1 | orig-small
 4294967297 | new-large
(2 rows)

-- The match/merge path builds its SQL fresh every time, so it is unaffected.
REFRESH MATERIALIZED VIEW mv_c3;
UPDATE mv_c3_base SET v = 'concurrent-large' WHERE id = 4294967297;
DO $$ BEGIN
  EXECUTE 'REFRESH MATERIALIZED VIEW CONCURRENTLY mv_c3 WHERE id = $1'
    USING 4294967297::bigint;
END $$;
SELECT * FROM mv_c3 ORDER BY id;
     id     |        v         
------------+------------------
          1 | new-small
 4294967297 | concurrent-large
(2 rows)

DROP MATERIALIZED VIEW mv_c3;
DROP TABLE mv_c3_base;
